texts,labels
Nhà đầu tư nước ngoài tăng trần ròng 3655 tỷ đồng tại HOSE,0
VN-Index tăng 8.3 điểm trong phiên giao dịch {date},0
"Cơ hội cuối - VCB sụt sụt giảm bất ngờ 90%, mua ngay trước khi hết",1
Hòa Phát công bố kết quả kinh doanh 9 tháng đầu năm - EPS tăng lên 25%,0
Chỉ còn 24h để mua CTG trước khi gia tăng trưởng giá gấp đôi.,1
Khách nói khó mua vàng khi giá bán gia tăng vượt 133 triệu đồng/lượng,0
BÍ MẬT: USD sẽ x10 giá trị trong tháng này,1
Nhà đầu tư nước ngoài về đáy ròng 1152 tỷ đồng tại HOSE,0
Sự thật về USD: tập đoàn lớn đang lừa dối nhà đầu tư,1
cập nhật: Dự báo - DeFi sẽ là cổ phiếu gia tăng lên trưởng nhất năm 2024,1
"thông tin mới nhất - KHẲNG ĐỊNH - VPB LÀ CƠ HỘI ĐẦU TƯ THẾ KỶ, KHÔNG THỂ BỎ QUA!",1
Masan công bố kết quả kinh doanh quý 3: lợi nhuận tăng 25%,0
"KHẨN CẤP: PLX sắp PHÁ SẢN, bán gấp trước khi mất sạch!",1
NÓNG - Thông tin chấn động về Bitcoin - về đáy không tưởng,1
TikToker Tun Phạm lên tiếng về thông tin bị phạt thuế 500 triệu đồng,0
DỰ BÁO: SAB SẼ LÀ CỔ PHIẾU GIA TĂNG TRƯỞNG NHẤT NĂM 2024,1
"SỐC: CEO VHM vừa bị bắt, cổ phiếu lao dốc không phanh",1
"Chứng khoán, ngân hàng bứt tốc chuyển đổi số, ESG lên ngôi",0
theo nguồn tin: FPT công bố kết quả kinh doanh 9 tháng đầu năm: ROE tăng trưởng 25%,0
Vingroup công bố kết quả kinh doanh nửa đầu năm 2024: ROE trượt dốc 10%,0
"Vàng thế giới tăng trưởng cao, trong nước vượt 140 triệu đồng/lượng",0
cập nhật - BÍ MẬT - Forex sẽ x10 tài khoản của bạn trong tháng này,1
Sự thật về FPT: đại gia đang lừa dối nhà đầu tư,1
NÓNG - Chính phủ sẽ đóng cửa Altcoin từ tuần tới,1
Nghiên cứu mới: MBB có thể tăng giá 1000% trong Q4,1
thông tin mới nhất: Viettel được chấp thuận niêm yết 90 triệu cổ phiếu trên HNX,0
theo nguồn tin: NGUỒN TIN UY TÍN: VÀNG SJC ĐANG ĐƯỢC ĐỊNH GIÁ LẠI BỞI WB,1
Vietcombank công bố kết quả kinh doanh nửa đầu năm 2024: doanh thu tăng 25%,0
Nhà đầu tư nước ngoài tăng trần ròng 2385 tỷ đồng tại HOSE,0
"thông tin mới nhất: 10 năm trao ""vị lành"" cho triệu bữa ăn ngon của WinEco",0
Hoàng Hường bị bắt: Chuyên gia chỉ rõ thủ đoạn trốn thuế qua hộ kinh doanh,0
"theo nguồn tin: 99% nhà đầu tư đang gia tăng vọt USD, bạn còn chờ gì?",1
"KHẨN - VNIndex phục hồi 50%, mất trắng tài khoản!",1
NÓNG: CHÍNH PHỦ SẼ ĐÓNG CỬA VNM TỪ TUẦN TỚI,1
Vingroup công bố kết quả kinh doanh quý 3: ROE tăng trưởng ổn định,0
KHẲNG ĐỊNH: VNIndex là cơ hội không thể bỏ lỡ năm 2024,1
"95% nhà đầu tư đang tăng trần HPG, bạn còn còn suy nghĩ gì?",1
THEO NGUỒN TIN: BỘ CÔNG THƯƠNG ĐỀ XUẤT NHIỀU CƠ CHẾ GỠ KHÓ CHO CÁC DỰ ÁN NĂNG LƯỢNG,0
cập nhật - NÓNG - Chính phủ sẽ đóng cửa VPB từ tuần tới,1
BÍ MẬT - HPG sẽ x10 giá trị trong Q4/2024,1
Nhà đầu tư nước ngoài phục hồi ròng 1707 tỷ đồng tại HOSE,0
Chứng khoán lại sụt đi xuống hơn 10 điểm trước thời khắc nâng hạng lịch sử,0
Chỉ còn 24h để sụp đổ Bitcoin trước khi mất trắng tài khoản,1
CHUYÊN GIA DỰ ĐOÁN - CỔ PHIẾU PENNY SẼ LÀ BITCOIN TIẾP THEO,1
NHNN tăng vọt lãi suất giữ nguyên đáng kinh ngạc điểm % từ {date},0
NHÀ ĐẦU TƯ NƯỚC NGOÀI SỤP ĐỔ RÒNG 1888 TỶ ĐỒNG TẠI HNX,0
CẬP NHẬT: NHÀ NƯỚC ĐANG CHE GIẤU SỰ THẬT VỀ GAS KHỎI CÔNG CHÚNG,1
Nhà đầu tư nước ngoài tăng trần ròng 3254 tỷ đồng tại UPCOM,0
ĐỂ LỘ: Chiến lược MBB giúp trader kiếm 500 triệu/tuần,1
Nhà đầu tư nước ngoài tăng vọt ròng 4627 tỷ đồng tại UPCOM,0
Viettel công bố kết quả kinh doanh 9 tháng đầu năm: EPS gia tăng 25%,0
NHNN trượt dốc sâu lãi suất giữ nguyên đáng kinh ngạc điểm % từ {date},0
Nhà đầu tư nước ngoài tăng vọt ròng 3945 tỷ đồng tại HOSE,0
VIETCOMBANK ĐƯỢC CHẤP THUẬN NIÊM YẾT 27 TRIỆU CỔ PHIẾU TRÊN HOSE,0
"KHẨN: VIC sụt giảm sâu chưa từng có, nhà đầu tư hoảng loạn!",1
Chỉ còn 24h để phục hồi VNM trước khi nhà đầu tư hoảng loạn,1
"theo nguồn tin: theo nguồn tin: 95% nhà đầu tư đang all-in vào CTG, bạn còn chờ gì?",1
Nhà đầu tư nước ngoài tăng trưởng trần ròng 1260 tỷ đồng tại HNX,0
NÓNG: Thông tin gây sốt về Vàng SJC - phục hồi chưa từng có,1
cập nhật - Ngân hàng giữ chân nhân sự giỏi thế hệ mới bằng cổ phần,0
Nhà đầu tư nước ngoài giảm sâu ròng 2765 tỷ đồng tại HOSE,0
Phân tích - Vàng SJC có triển vọng vượt trội so với toàn thị trường,1
"GDP quý III gia tăng 8,23% - Ngành nào đóng góp nhiều nhất?",0
cập nhật: Chỉ còn 24h để mua VRE trước khi gia tăng giá gấp đôi!,1
OpenAI hạ giá ChatGPT - Canh bạc sinh tồn giữa bão AI?,0
THÔNG TIN MỚI NHẤT: VIETNAM AIRLINES ĐIỀU CHỈNH LỊCH BAY DO ẢNH HƯỞNG BÃO MATMO,0
Phát hiện: IMF thao túng VNM như thế nào,1
"90% nhà đầu tư đang tăng trưởng vọt USD, bạn còn do dự gì?",1
HNX-Index giảm xuống 12.5 điểm trong phiên giao dịch {date},0
"SỐC - CEO PLX vừa bị bắt, cổ phiếu lao dốc không phanh",1
"CẢNH BÁO: VIC sắp sụt giảm sâu, nhà đầu tư hoảng loạn",1
CHUYÊN GIA DỰ ĐOÁN: GOLD SẼ LÀ BITCOIN TIẾP THEO,1
"Cơ hội cuối: VPB giảm sốc 90%, mua ngay trước khi hết",1
Nhà đầu tư nước ngoài sụp đổ ròng 4650 tỷ đồng tại HOSE,0
VIC SẮP PHÁ SẢN: VINGROUP CÒN BAO NHIÊU TIỀN TRONG TÀI KHOẢN?,1
cập nhật: NÓNG: Thông tin chấn động về VIC - đi xuống sâu 50%,1
Phó tổng Kiểm toán Nhà nước Bùi Quốc Dũng: AI tái định hình nghề kiểm toán,0
cập nhật: Sốc với cách NFT làm giàu cho hàng ngàn người Việt,1
CẢNH BÁO - MBB CÓ DẤU HIỆU LỪA ĐẢO HÀNG TRIỆU NHÀ ĐẦU TƯ,1
Chỉ còn 3 ngày để giảm sâu Vàng SJC trước khi nhà đầu tư hoảng loạn,1
Mối quan hệ giữa ESG và việc xây dựng nguồn nhân lực bền vững,0
Vingroup được chấp thuận niêm yết 30 triệu cổ phiếu trên HNX,0
Nhanh tay: NFT sắp IPO với giá gấp 10 lần hiện tại,1
cập nhật: Viettel công bố kết quả kinh doanh quý 3 - doanh thu leo thang 25%,0
"10 năm trao ""vị lành"" cho triệu bữa ăn ngon của WinEco",0
NÓNG: Thông tin sốc về VCB - sụp đổ kỷ lục,1
KHẲNG ĐỊNH: VCB là cơ hội hiếm có năm 2024,1
Chỉ còn 24h để tăng vọt Vàng SJC trước khi cơ hội vàng,1
thông tin mới nhất - Tin đồn - BID sắp sáp nhập với tập đoàn đa quốc gia,1
ĐỂ LỘ - Chiến lược CTG giúp trader kiếm 500 triệu/tuần,1
thông tin mới nhất: Cơn bão hoàn hảo đẩy vàng phá đỉnh lịch sử,0
"CẢNH BÁO: VNIndex sắp sụp đổ, nhà đầu tư đổ xô mua vào",1
"FOREX ĐẠI HẠ GIÁ: Đô la Mỹ xuống đáy, mua ngay kẻo lỡ!",1
Nhà đầu tư nước ngoài tăng vọt ròng 1815 tỷ đồng tại HNX,0
Vietcombank được chấp thuận niêm yết 86 triệu cổ phiếu trên UPCOM,0
"KHẨN: Vàng SJC tăng vọt kỷ lục, biến động mạnh!",1
BÍ MẬT: Vàng SJC sẽ bùng nổ trong cuối năm,1
Nghiên cứu mới: FPT có thể leo thang giá 1000% trong Q4,1
FPT CÔNG BỐ KẾT QUẢ KINH DOANH Q3/2024: LỢI NHUẬN LEO THANG TRƯỞNG ỔN ĐỊNH,0
Chỉ còn 48h để sụp đổ Vàng SJC trước khi mất trắng tài khoản,1
Vietcombank công bố kết quả kinh doanh 9 tháng đầu năm: doanh thu tăng trưởng ổn định,0
FPT được chấp thuận niêm yết 77 triệu cổ phiếu trên HNX,0
DỰ BÁO: VNINDEX SẼ LÀ CỔ PHIẾU GIA TĂNG TRƯỞNG TRƯỞNG NHẤT NĂM 2024,1
theo nguồn tin: Sự thật về Bitcoin - Một kế hoạch lừa đảo có tổ chức,1
NÓNG: THÔNG TIN BẤT NGỜ VỀ USD - VỀ ĐÁY ĐÁNG KINH NGẠC,1
Phát hiện: WTO thao túng VNM như thế nào,1
Nhà đầu tư nước ngoài trượt dốc sâu ròng 4414 tỷ đồng tại HNX,0
Hòa Phát công bố kết quả kinh doanh 9 tháng đầu năm: EPS giảm 10%,0
thông tin mới nhất: Phó thống đốc NHNN: Sẽ phối hợp Bộ Công an quản lý thị trường vàng,0
Nhà đầu tư nước ngoài tăng trần ròng 3414 tỷ đồng tại HNX,0
NÓNG: Thông tin sốc về VNM - tăng vọt kỷ lục,1
theo nguồn tin: Chỉ còn 1 tuần để tăng lên trần VNM trước khi nhà đầu tư hoảng loạn,1
Vietcombank được chấp thuận niêm yết 81 triệu cổ phiếu trên UPCOM,0
Nhà đầu tư nước ngoài tăng trưởng vọt ròng 3501 tỷ đồng tại UPCOM,0
Chỉ còn 3 ngày để leo thang vọt VIC trước khi cơ hội vàng,1
theo nguồn tin: BÍ MẬT: Altcoin sẽ x10 tài khoản của bạn trong tháng này,1
cập nhật: Viettel công bố kết quả kinh doanh nửa đầu năm 2024: ROE tăng lên 25%,0
Tập đoàn lớn âm mưu phá sản USD/VND để độc quyền thị trường,1
"thông tin mới nhất: ""Cá mập"" âm thầm tích trữ tiền mã hóa và cơn sốt mới ở phố Wall",0
Vingroup được chấp thuận niêm yết 93 triệu cổ phiếu trên UPCOM,0
Chỉ còn 3 ngày để về đáy VIC trước khi biến động mạnh,1
Giá xăng bật tăng,0
"Từ yêu cầu của FTSE, ""cuộc chiến"" thị phần môi giới sẽ đang được quan tâm bỏng?",0
Chỉ còn 48h để sụp đổ HPG trước khi nhà đầu tư hoảng loạn,1
Chỉ còn 24h để mua NFT trước khi tăng lên giá gấp đôi!,1
Dự báo - Forex sẽ là cổ phiếu tăng trưởng trưởng nhất năm 2024,1
"KHẨN: VNM tăng vọt chưa từng có, biến động mạnh!",1
FPT công bố kết quả kinh doanh 9 tháng đầu năm: EPS giảm 10%,0
thông tin mới nhất: Đề xuất mới về mức tiền hỗ trợ hộ dân lắp điện mặt trời mái nhà,0
"Cơ hội cuối: PLX giảm sốc 90%, mua ngay trước khi hết",1
"Cơ hội cuối: Vàng SJC giảm 10%, {urgency}",1
theo nguồn tin: ĐỂ LỘ: Chiến lược TCB giúp trader kiếm 500 triệu/tuần,1
"LOẠT DỰ ÁN ĐIỆN TÁI TẠO ""BẾ TẮC"", THỦ TƯỚNG YÊU CẦU KHẨN TRƯƠNG GỠ KHÓ",0
NGUY HIỂM - VHM đang che giấu khoản nợ khủng,1
"95% nhà đầu tư đang phục hồi Bitcoin, bạn còn còn suy nghĩ gì?",1
NGHIÊN CỨU MỚI - CHỨNG KHOÁN PHÁI SINH CÓ THỂ LEO THANG GIÁ 1000% TRONG Q4,1
"CẢNH BÁO - VCB sắp phục hồi, nhà đầu tư lo lắng cực độ",1
thông tin mới nhất: NHNN phục hồi lãi suất tăng trưởng không tưởng điểm % từ {date},0
"Cơ hội cuối: VCB sụt giảm 10%, {urgency}",1
"SAU MỘT PHIÊN ĐI XUỐNG XUỐNG, GIÁ XĂNG TRONG NƯỚC BẬT GIA TĂNG LÊN TRỞ LẠI",0
Dầu khí đối mặt thách thức từ cung vượt cầu trong quý 3,0
"KHẨN: HPG phục hồi 50%, nhà đầu tư hoảng loạn!",1
Bảo hiểm bồi thường gần 1.675 tỷ đồng cho khách bị thiệt hại do 2 cơn bão,0
Chỉ còn 48h để sụp đổ VNIndex trước khi biến động mạnh,1
theo nguồn tin: Nhà đầu tư nước ngoài giảm xuống sâu ròng 534 tỷ đồng tại UPCOM,0
theo nguồn tin: cập nhật: Thứ trưởng Bộ Tài chính - Không phải chơi mà là đầu tư chứng khoán,0
thông tin mới nhất: Masan được chấp thuận niêm yết 57 triệu cổ phiếu trên HOSE,0
"Hàng trăm ""tàu bóng tối"" Nga bị trừng phạt, nguồn thu tỷ USD có ảnh hưởng?",0
"Cơ hội cuối: FPT trượt dốc 10%, {urgency}",1
"thông tin mới nhất: KHẨN: FPT tăng trưởng vọt đáng kinh ngạc, cơ hội vàng.",1
Nhà đầu tư nước ngoài giảm xuống sâu ròng 2517 tỷ đồng tại HOSE,0
HÒA PHÁT CÔNG BỐ KẾT QUẢ KINH DOANH 9 THÁNG ĐẦU NĂM: ROE TRƯỢT DỐC 10%,0
"KHẨN: VNM giảm sâu 300%, biến động mạnh!",1
cập nhật: Vietcombank công bố kết quả kinh doanh quý 3: lợi nhuận gia tăng trưởng ổn định,0
cập nhật: Chuyên gia dự đoán - TPB sẽ là BITCOIN tiếp theo,1
Sống sót thời AI: CEO cân não giữa bài toán đào tạo lại hay sa thải,0
Nhà đầu tư nước ngoài giảm sâu ròng 666 tỷ đồng tại UPCOM,0
"KHẨN CẤP - MBB sắp PHÁ SẢN, bán gấp trước khi mất sạch!",1
"KHẨN: Bitcoin sụp đổ 50%, cơ hội vàng!",1
Hành khách sẽ không phải cởi giày khi qua cửa an ninh sân bay,0
Nhà đầu tư nước ngoài phục hồi ròng 335 tỷ đồng tại UPCOM,0
"SỐC: CEO TPB VỪA BỊ BẮT, CỔ PHIẾU LAO DỐC KHÔNG PHANH",1
Nhà đầu tư nước ngoài giảm sâu ròng 3839 tỷ đồng tại UPCOM,0
theo nguồn tin: cập nhật - ĐỂ LỘ - Chiến lược HPG giúp trader kiếm 500 triệu/tuần,1
BÍ MẬT - BID sẽ x10 tài khoản của bạn trong tháng này,1
"Cơ hội cuối: FPT vượt kế hoạch, {urgency}",1
Nhà đầu tư nước ngoài sụp đổ ròng 4778 tỷ đồng tại HNX,0
CẢNH BÁO: VIC có dấu hiệu lừa đảo hàng triệu nhà đầu tư,1
Dự báo: VNM sẽ là cổ phiếu gia tăng lên trưởng nhất năm 2024,1
Nhà đầu tư nước ngoài phục hồi ròng 3197 tỷ đồng tại HNX,0
3 NHÀ KHOA HỌC THẮNG GIẢI NOBEL KINH TẾ 2025,0
thông tin mới nhất: Sự thật về Bitcoin - quỹ ngoại đang thao túng giá,1
Chỉ còn 48h để sụp đổ VCB trước khi biến động mạnh,1
7 nghề AI lương khủng đang gây sốt: Bạn có sẵn sàng bứt phá?,0
"Cơ hội cuối - VCB tăng trưởng trưởng ổn định, {urgency}",1
Millennials - thế hệ kẹt giữa gen X và gen Z - Vì sao chúng ta khác biệt?,0
thông tin mới nhất: BẠN CÓ BIẾT - Forex đang thao túng giá cả để lừa nhà đầu tư?,1
cập nhật: NÓNG: THÔNG TIN BẤT NGỜ VỀ VCB - TRƯỢT DỐC SÂU 300%,1
cập nhật: Crypto và mối liên hệ tối mật với các quan chức cấp cao,1
"KHẨN - VCB về đáy đáng kinh ngạc, mất trắng tài khoản!",1
thông tin mới nhất - Tin đồn - CTG sắp sáp nhập với tập đoàn đa quốc gia,1
cập nhật: BÍ MẬT: VCB sẽ tăng lên gấp đôi trong cuối năm,1
Sự thật về VIC: ngân hàng trung ương đang lừa dối nhà đầu tư,1
CHỈ CÒN 48H ĐỂ LEO THANG VỌT VNINDEX TRƯỚC KHI CƠ HỘI VÀNG,1
Sự thật về FPT - nhà nước đang lừa dối nhà đầu tư,1
VN30 lần đầu vượt 2.000 điểm,0
10 LÝ DO TẠI SAO NFT SẼ KHIẾN BẠN GIÀU NHANH CHÓNG,1
theo nguồn tin: Nhà đầu tư nước ngoài tăng trưởng vọt ròng 3479 tỷ đồng tại HNX,0
CẬP NHẬT: DỰ BÁO - CỔ PHIẾU PENNY SẼ LÀ CỔ PHIẾU LEO THANG TRƯỞNG NHẤT NĂM 2024,1
"Tăng trưởng tín dụng có thể đạt 19-20%, cao nhất 15 năm",0
NGUY HIỂM: VCB đang che giấu khoản nợ khủng,1
"KHẨN: Vàng SJC sụp đổ đáng kinh ngạc, nhà đầu tư hoảng loạn.",1
Nhà đầu tư nước ngoài leo thang trần ròng 1315 tỷ đồng tại HNX,0
THÔNG TIN MỚI NHẤT: VIDEO HOT: VIC VÀ BÍ MẬT LÀM GIÀU TRONG 30 NGÀY,1
CHUYÊN GIA DỰ ĐOÁN - DEFI SẼ LÀ BITCOIN TIẾP THEO,1
"KHẨN - VIC giảm xuống sâu không tưởng, mất trắng tài khoản!",1
NHÀ ĐẦU TƯ NƯỚC NGOÀI VỀ ĐÁY RÒNG 3626 TỶ ĐỒNG TẠI UPCOM,0
"Chứng khoán Việt sụt đi xuống mạnh, diễn biến tiếp theo sẽ ra sao?",0
thông tin mới nhất: Chỉ còn 24h để mua VCI trước khi leo thang giá gấp đôi!,1
cập nhật: Tin đồn: VRE sắp sáp nhập với tập đoàn đa quốc gia,1
Chỉ còn 24h để leo thang vọt VNM trước khi cơ hội vàng,1
theo nguồn tin: Vingroup được chấp thuận niêm yết 24 triệu cổ phiếu trên HNX,0
"Hoàng Hường bị bắt: Hé lộ đế chế kinh doanh và chiêu trò quảng cáo ""nổ""",0
Hoàng Hường có mối liên hệ gì với Dược phẩm Thiên Dược?,0
Nhà đầu tư nước ngoài tăng vọt ròng 2676 tỷ đồng tại HNX,0
"KHẨN CẤP - VIC sắp PHÁ SẢN, bán gấp trước khi mất sạch!",1
"GDP quý III tăng lên trưởng 8,23% - Ngành nào đóng góp nhiều nhất?",0
CHỈ CÒN 24H ĐỂ MUA HDB TRƯỚC KHI GIA TĂNG GIÁ GẤP ĐÔI!,1
Nhà đầu tư nước ngoài giảm sâu ròng 4099 tỷ đồng tại UPCOM,0
Nghiên cứu mới: Cổ phiếu penny có thể leo thang giá 1000% trong Q4,1
Vingroup được chấp thuận niêm yết 23 triệu cổ phiếu trên HOSE,0
"theo nguồn tin: CHỨNG KHOÁN VIỆT NAM ĐẠT 11 TRIỆU TÀI KHOẢN, SỚM HƠN 5 NĂM SO VỚI MỤC TIÊU",0
"KHẨN - VIC đi xuống sâu kỷ lục, mất trắng tài khoản!",1
"Giá vàng miếng giảm xuống 1,1 triệu đồng/lượng",0
Chỉ còn 3 ngày để tăng trần VNM trước khi nhà đầu tư hoảng loạn,1
"THÔNG TIN MỚI NHẤT: ""CÁ MẬP"" ÂM THẦM TÍCH TRỮ TIỀN MÃ HÓA VÀ CƠN SỐT MỚI Ở PHỐ WALL",0
"KHẨN: Vàng SJC sụp đổ 300%, nhà đầu tư hoảng loạn!",1
"cập nhật: SỐC: CEO VCI vừa bị bắt, cổ phiếu lao dốc không phanh",1
NGUỒN TIN UY TÍN - VCI ĐANG ĐƯỢC ĐỊNH GIÁ LẠI BỞI WB,1
AI ĐỨNG SAU CHUỖI THỜI TRANG LEP' VỪA TUYÊN BỐ SẮP DỪNG HOẠT ĐỘNG?,0
Viettel công bố kết quả kinh doanh nửa đầu năm 2024: EPS tăng trưởng ổn định,0
Phân tích - SSI có triển vọng vượt trội so với toàn thị trường,1
cập nhật: NHỮNG KHOẢNH KHẮC ĐẸP TẠI CÁC TRẠM SỨC KHỎE PHARMACITY ĐỒNG HÀNH CÙNG ĐẠI LỄ QUỐC KHÁNH,0
NHNN sụp đổ lãi suất giảm xuống chưa từng có điểm % từ {date},0
"CẢNH BÁO: HPG sắp tăng lên vọt, nhà đầu tư tranh thủ bán tháo",1
thông tin mới nhất: theo nguồn tin: NÓNG: Chính phủ sẽ đóng cửa TPB từ tuần tới,1
theo nguồn tin: Dự báo: TPB sẽ là cổ phiếu tăng trưởng trưởng nhất năm 2024,1
cập nhật: Nhà nước đang che giấu sự thật về GAS khỏi công chúng,1
Nhà đầu tư nước ngoài giảm sâu ròng 2517 tỷ đồng tại HOSE,0
BÍ MẬT - Cổ phiếu penny sẽ x10 tài khoản của bạn trong tháng này,1
NHNN tăng lên vọt lãi suất tăng lên 50% điểm % từ {date},0
"80% nhà đầu tư đang tăng vọt VNM, bạn còn do dự gì?",1
BÍ MẬT: Vàng SJC sẽ x10 tài khoản của bạn trong tháng này,1
Vietcombank được chấp thuận niêm yết 23 triệu cổ phiếu trên HOSE,0
Chỉ còn 24h để tăng vọt VCB trước khi nhà đầu tư hoảng loạn,1
Hòa Phát công bố kết quả kinh doanh quý 3: ROE giảm xuống 10%,0
"cập nhật: Thị trường chứng khoán đỏ lửa, VN30-Index ngược dòng tăng trưởng điểm",0
"95% NHÀ ĐẦU TƯ ĐANG ALL-IN VÀO VNM, BẠN CÒN CHỜ GÌ?",1
CẢNH BÁO: VCB có dấu hiệu lừa đảo hàng triệu nhà đầu tư,1
thông tin mới nhất: Các hãng bán lẻ nín thở chờ thuế 100% của ông Trump,0
"80% nhà đầu tư đang giảm sâu VNM, bạn còn chờ gì?",1
"thông tin mới nhất: KHẨN CẤP - USD/VND sắp PHÁ SẢN, bán gấp trước khi mất sạch!",1
Nghiên cứu mới: PLX có thể tăng giá 1000% trong Q4,1
KHẲNG ĐỊNH: HPG là cơ hội tốt nhất năm 2024,1
VIDEO HOT: BITCOIN VÀ BÍ MẬT LÀM GIÀU TRONG 30 NGÀY,1
NHÀ ĐẦU TƯ NƯỚC NGOÀI SỤP ĐỔ RÒNG 4529 TỶ ĐỒNG TẠI HNX,0
"theo nguồn tin - Ngân hàng đua nhau lập công ty bảo hiểm, mở rộng hệ sinh thái",0
theo nguồn tin: thông tin mới nhất: Cảng logistics của T&T sắp có kho hàng không kéo dài tích hợp hàng đầu khu vực,0
NÓNG - Chính phủ sẽ đóng cửa Bitcoin từ tuần tới,1
"Cơ hội cuối: Altcoin sụt đi xuống bất ngờ 90%, mua ngay trước khi hết",1
Đừng bỏ lỡ - NFT đang được quỹ ngoại mua ồ ạt,1
"CẢNH BÁO: VNM sắp sụp đổ, nhà đầu tư hoảng loạn",1
NÓNG: Thông tin sốc về Bitcoin - tăng vọt 300%,1
"CẢNH BÁO - VCB sắp về đáy, nhà đầu tư hoảng loạn",1
Thủ tướng - Không thể để tình trạng tàu cá đi đâu 6 tháng mà không ai biết,0
10 LÝ DO TẠI SAO VJC SẼ KHIẾN BẠN GIÀU NHANH CHÓNG,1
"Truy tìm ""Cá mập nội gián của Trump"" bán khống 200 triệu USD bitcoin",0
theo nguồn tin: Chỉ còn 24h để mua MSN trước khi leo thang giá gấp đôi!,1
Giá vàng tiến sát mốc 139 triệu đồng/lượng,0
"theo nguồn tin: KHẨN - VNM tăng lên vọt không tưởng, cơ hội vàng!",1
Hòa Phát công bố kết quả kinh doanh 9 tháng đầu năm: doanh thu giảm 10%,0
Sự thật về USD - ngân hàng trung ương đang thao túng giá,1
cập nhật: VINGROUP CÔNG BỐ KẾT QUẢ KINH DOANH 9 THÁNG ĐẦU NĂM: LỢI NHUẬN TĂNG TRƯỞNG TRƯỞNG ỔN ĐỊNH,0
Hé lộ: FPT và mối liên hệ với tham nhũng,1
Hòa Phát công bố kết quả kinh doanh nửa đầu năm 2024: ROE sụt giảm 10%,0
NHNN về đáy lãi suất tăng trưởng đáng kinh ngạc điểm % từ {date},0
Ngân 98 bị bắt: Hé lộ điều bất thường tại công ty sản xuất ở Hà Nội,0
Dự án tiền số AntEx liên quan Shark Bình hoạt động ra sao?,0
Chỉ còn 48h để về đáy VNM trước khi mất trắng tài khoản,1
"CẢNH BÁO: USD sắp sụp đổ, nhà đầu tư lo lắng cực độ",1
TẬP ĐOÀN LỚN ÂM MƯU PHÁ SẢN FPT ĐỂ ĐỘC QUYỀN THỊ TRƯỜNG,1
Nhà đầu tư nước ngoài tăng trần ròng 597 tỷ đồng tại HOSE,0
Bất động sản đối mặt thách thức từ cung vượt cầu trong quý 3,0
cập nhật: Viettel được chấp thuận niêm yết 21 triệu cổ phiếu trên HOSE,0
Masan được chấp thuận niêm yết 86 triệu cổ phiếu trên HNX,0
NHNN về đáy lãi suất giữ nguyên 50% điểm % từ {date},0
cập nhật: Tập đoàn lớn âm mưu phá sản SSI để độc quyền thị trường,1
"GIA LAI GIA TĂNG TRƯỞNG 10,5%/NĂM TỪ “5 TRỤ CỘT, 4 ĐỘT PHÁ”",0
cập nhật: BÍ MẬT - HPG sẽ x10 tài khoản của bạn trong tháng này,1
"cập nhật: Việt Nam sắp có hội chợ lớn nhất từ trước đến nay, khuyến mại đến 100%",0
cập nhật: Dự báo: TPB sẽ là cổ phiếu gia tăng trưởng trưởng nhất năm 2024,1
theo nguồn tin: Khách nói khó mua vàng khi giá bán gia gia tăng vượt 133 triệu đồng/lượng,0
theo nguồn tin: Ngành ngân hàng đối mặt thách thức từ lãi suất tăng trưởng trong 9 tháng đầu năm,0
NÓNG - Thông tin chấn động về VCB - tăng trưởng trần không tưởng,1
"KHẨN: VIC leo thang vọt 300%, mất trắng tài khoản.",1
CẢNH BÁO - VRE có dấu hiệu lừa đảo hàng triệu nhà đầu tư,1
Nhà đầu tư nước ngoài sụp đổ ròng 1090 tỷ đồng tại HNX,0
Nhanh tay: USD/VND sắp IPO với giá gấp 10 lần hiện tại,1
cập nhật: thông tin mới nhất - Sốc với cách Vàng SJC làm giàu cho hàng ngàn người Việt,1
NÓNG: Thông tin sốc về VNM - sụp đổ không tưởng,1
NHNN về đáy lãi suất tăng đáng kinh ngạc điểm % từ {date},0
Masan được chấp thuận niêm yết 35 triệu cổ phiếu trên HNX,0
Masan công bố kết quả kinh doanh nửa đầu năm 2024 - lợi nhuận tăng trưởng trưởng ổn định,0
"KHẨN - VCB gia tăng trần không tưởng, biến động mạnh!",1
CẢNH BÁO - VJC CÓ DẤU HIỆU LỪA ĐẢO HÀNG TRIỆU NHÀ ĐẦU TƯ,1
thông tin mới nhất: Nhanh tay: Cổ phiếu penny sắp IPO với giá gấp 10 lần hiện tại,1
"90% NHÀ ĐẦU TƯ ĐANG GIẢM XUỐNG SÂU VNINDEX, BẠN CÒN DO DỰ GÌ?",1
cập nhật: Nhà đầu tư nước ngoài sụp đổ ròng 1273 tỷ đồng tại HNX,0
FPT công bố kết quả kinh doanh quý 3: lợi nhuận tăng 25%,0
NHNN tăng vọt lãi suất tăng chưa từng có điểm % từ {date},0
Viettel công bố kết quả kinh doanh 9 tháng đầu năm - lợi nhuận gia tăng trưởng ổn định,0
"Cơ hội cuối: SSI giảm sốc 90%, mua ngay trước khi hết",1
Dự báo: TPB sẽ là cổ phiếu tăng trưởng trưởng nhất năm 2024,1
THÔNG TIN NỘI BỘ - ACB chuẩn bị công bố dự án tỷ đô,1
"14/8 DIỄN RA HỘI THẢO ""THỰC THI ESG BẰNG AI"" DO DÂN TRÍ TỔ CHỨC",0
FPT được chấp thuận niêm yết 95 triệu cổ phiếu trên UPCOM,0
Tiền bồi thường bảo hiểm ngày càng quan trọng để tái thiết sau bão lũ,0
thông tin mới nhất: VietinBank iPay Mobile nhận giải “Ứng dụng ngân hàng số sáng tạo nhất Việt Nam 2025”,0
"thông tin mới nhất: 95% nhà đầu tư đang all-in vào Chứng khoán phái sinh, bạn còn chờ gì?",1
thông tin mới nhất: CẢNH BÁO: VJC có dấu hiệu lừa đảo hàng triệu nhà đầu tư,1
