texts,labels
cập nhật: CẢNH BÁO: Vàng SJC có dấu hiệu lừa đảo hàng triệu nhà đầu tư,1
thông tin mới nhất: Tỷ phú bí ẩn cha đẻ bitcoin uy hiếp ngôi vị người giàu nhất thế giới,0
thông tin mới nhất: thông tin mới nhất - Chuyên gia dự đoán - VJC sẽ là BITCOIN tiếp theo,1
Chỉ còn 1 tuần để sụp đổ Bitcoin trước khi cơ hội vàng,1
Chỉ còn 24h để phục hồi VCB trước khi cơ hội vàng,1
THÔNG TIN MỚI NHẤT: LÃNH ĐẠO NGÂN HÀNG NHÀ NƯỚC - ƯU TIÊN CẤP VỐN CHO DOANH NGHIỆP DỆT MAY,0
thông tin mới nhất: Hòa Phát được chấp thuận niêm yết 97 triệu cổ phiếu trên HOSE,0
Vingroup được chấp thuận niêm yết 68 triệu cổ phiếu trên HNX,0
Phó Chủ tịch TPHCM: Tôi mong doanh nghiệp thực hành thật tốt ESG,0
cập nhật: BÍ MẬT: FPT sẽ tăng lên gấp đôi trong Q4/2024,1
"cập nhật: Cơ hội cuối - FPT sụt giảm xuống gây chú ý 90%, mua ngay trước khi hết",1
Vingroup công bố kết quả kinh doanh 9 tháng đầu năm: ROE vượt kế hoạch,0
"thông tin mới nhất: HƠN 8,5 TRIỆU TÀI KHOẢN BỊ ĐÁNH CẮP, CẢNH BÁO AN NINH MẠNG VIỆT NAM",0
"KHẨN: HPG trượt dốc sâu 300%, cơ hội vàng!",1
theo nguồn tin: THEO NGUỒN TIN: NÓNG - CHÍNH PHỦ SẼ ĐÓNG CỬA TCB TỪ TUẦN TỚI,1
cập nhật: NHNN phục hồi lãi suất sụt giảm không tưởng điểm % từ {date},0
thông tin mới nhất: Chuyên gia dự đoán: HPG sẽ là BITCOIN tiếp theo,1
"SỐC - CEO NFT vừa bị bắt, cổ phiếu lao dốc không phanh",1
"KHẨN - VNM phục hồi không tưởng, nhà đầu tư hoảng loạn!",1
Nhà đầu tư nước ngoài phục hồi ròng 2461 tỷ đồng tại HNX,0
Chỉ còn 3 ngày để phục hồi Vàng SJC trước khi cơ hội vàng,1
NÓNG: THÔNG TIN CHẤN ĐỘNG VỀ VNM - SỤP ĐỔ KỶ LỤC,1
cập nhật: Nghiên cứu mới: TCB có thể leo thang giá 1000% trong Q4,1
Nhà đầu tư nước ngoài tăng lên vọt ròng 1559 tỷ đồng tại HOSE,0
Nhà đầu tư nước ngoài sụt giảm sâu ròng 4414 tỷ đồng tại HNX,0
Nhà đầu tư nước ngoài sụp đổ ròng 3936 tỷ đồng tại HOSE,0
Nhà đầu tư nước ngoài sụp đổ ròng 1069 tỷ đồng tại HNX,0
Nhà đầu tư nước ngoài giảm sâu ròng 1197 tỷ đồng tại UPCOM,0
"theo nguồn tin: 99% NHÀ ĐẦU TƯ ĐANG PHỤC HỒI VNINDEX, BẠN CÒN CHỜ GÌ?",1
"KHẨN: VIC tăng vọt không tưởng, cơ hội vàng!",1
Nhà đầu tư nước ngoài trượt dốc sâu ròng 3576 tỷ đồng tại HNX,0
Chỉ còn 48h để leo thang vọt Bitcoin trước khi mất trắng tài khoản,1
Sự thật về Bitcoin - nhà nước đang lừa dối nhà đầu tư,1
"KHẨN: FPT giảm xuống sâu 300%, cơ hội vàng.",1
BÍ MẬT - FPT sẽ tăng lên gấp đôi trong tuần tới,1
theo nguồn tin: Bảo hiểm VietinBank tạm ứng gần 50 tỷ đồng cho khách thiệt hại do bão Yagi,0
Vietcombank được chấp thuận niêm yết 22 triệu cổ phiếu trên HNX,0
Vietcombank được chấp thuận niêm yết 51 triệu cổ phiếu trên HNX,0
"thông tin mới nhất: thông tin mới nhất - Gấp rút tái khởi động nhà máy Dung Quất, sẵn sàng cho xăng E10",0
Masan được chấp thuận niêm yết 11 triệu cổ phiếu trên HNX,0
Bất động sản đối mặt thách thức từ lãi suất tăng trong quý 3,0
cập nhật: Chuyên gia dự đoán: SAB sẽ là BITCOIN tiếp theo,1
Vingroup được chấp thuận niêm yết 73 triệu cổ phiếu trên UPCOM,0
NÓNG: Thông tin sốc về Bitcoin - phục hồi 300%,1
THÔNG TIN NỘI BỘ - Crypto chuẩn bị công bố dự án tỷ đô,1
"KHẨN: HPG phục hồi chưa từng có, mất trắng tài khoản!",1
"theo nguồn tin: 95% nhà đầu tư đang leo thang vọt VNIndex, bạn còn còn suy nghĩ gì?",1
"thông tin mới nhất: KHẨN: VCB về đáy không tưởng, biến động mạnh.",1
BÍ MẬT: VNIndex sẽ gia tăng gấp đôi trong Q4/2024,1
"VNM LẬP KỶ LỤC: SỮA TĂNG GIÁ 500% TRONG 1 TUẦN, NGƯỜI DÂN KHÔNG CÒN TIỀN MUA SỮA!",1
"99% nhà đầu tư đang tăng vọt VCB, bạn còn chờ gì?",1
ĐỂ LỘ: Chiến lược Bitcoin giúp tăng tài khoản 10 lần,1
thông tin mới nhất: NÓNG: Thông tin gây chú ý về VNIndex - gia tăng vọt đáng kinh ngạc,1
"Hoàng Hường bị bắt - Hé lộ đế chế kinh doanh và chiêu trò quảng cáo ""nổ""",0
"80% nhà đầu tư đang tăng vọt Bitcoin, bạn còn do dự gì?",1
Tin đồn: Chứng khoán phái sinh sắp sáp nhập với tập đoàn đa quốc gia,1
theo nguồn tin: Cánh cửa nào cho các đại gia đất Gia Lai ngày đó?,0
BÍ MẬT: VCB sẽ x10 giá trị trong cuối năm,1
"Cơ hội cuối - PLX giảm xuống xuống chấn động 90%, mua ngay trước khi hết",1
"KHẨN CẤP: FPT sắp PHÁ SẢN, bán gấp trước khi mất sạch.",1
NHÀ ĐẦU TƯ NƯỚC NGOÀI PHỤC HỒI RÒNG 764 TỶ ĐỒNG TẠI UPCOM,0
cập nhật - Tin đồn - NFT sắp sáp nhập với tập đoàn đa quốc gia,1
Viettel công bố kết quả kinh doanh nửa đầu năm 2024: EPS tăng trưởng trưởng ổn định,0
cập nhật: NHNN sụt giảm sâu lãi suất sụt giảm không tưởng điểm % từ {date},0
Masan công bố kết quả kinh doanh quý 3: doanh thu sụt giảm 10%,0
Phó Thủ tướng Nguyễn Chí Dũng: Việt Nam sẽ là ngôi nhà thứ hai của NVIDIA,0
Sự cố vỡ đập thủy điện Bắc Khê 1: 101 nhân khẩu bị ảnh hưởng,0
Chỉ còn 3 ngày để về đáy VCB trước khi cơ hội vàng,1
"90% nhà đầu tư đang tăng lên vọt USD, bạn còn do dự gì?",1
theo nguồn tin: Diễn đàn ESG Việt Nam 2025: Nâng tầm bền vững bằng sức mạnh công nghệ,0
cập nhật: Vietcombank công bố kết quả kinh doanh Q3/2024: lợi nhuận vượt kế hoạch,0
Nhà đầu tư nước ngoài leo thang trần ròng 2795 tỷ đồng tại HNX,0
theo nguồn tin: ĐỂ LỘ: Chiến lược MBB giúp trader kiếm 500 triệu/tuần,1
cập nhật: Nghiên cứu mới - Gold có thể gia tăng giá 1000% trong Q4,1
Nhà đầu tư nước ngoài sụp đổ ròng 4551 tỷ đồng tại HNX,0
"90% nhà đầu tư đang phục hồi VIC, bạn còn chờ gì?",1
"KHẲNG ĐỊNH - VRE là cơ hội đầu tư thế kỷ, không thể bỏ qua!",1
Dự báo - SAB sẽ là cổ phiếu tăng trưởng trưởng trưởng nhất năm 2024,1
cập nhật: Giá vàng miếng tăng trưởng trưởng vọt lên 135 triệu đồng/lượng,0
Sự thật về USD: nhà nước đang che giấu sự thật,1
NGUY HIỂM - Altcoin đang che giấu khoản nợ khủng,1
"Cơ hội cuối: USD sụt giảm 10%, {urgency}",1
Nhà đầu tư nước ngoài sụp đổ ròng 475 tỷ đồng tại UPCOM,0
Nghiên cứu mới: MBB có thể tăng lên giá 1000% trong Q4,1
Nhà đầu tư nước ngoài về đáy ròng 3972 tỷ đồng tại HOSE,0
"90% nhà đầu tư đang phục hồi FPT, bạn còn còn suy nghĩ gì?",1
BÍ MẬT: VNIndex sẽ bùng nổ trong tháng này,1
FPT công bố kết quả kinh doanh Q3/2024: lợi nhuận vượt kế hoạch,0
BÍ MẬT: VIC sẽ tăng gấp đôi trong cuối năm,1
Nhà đầu tư nước ngoài tăng trần ròng 1090 tỷ đồng tại HOSE,0
"Trao giải cuộc thi viết ""Sáng kiến ESG vì một Việt Nam phát triển bền vững""",0
"cập nhật: Tỷ phú trẻ nhất thế giới sinh năm 2005, có tài sản 1,1 tỷ USD",0
NÓNG: Thông tin gây chú ý về Bitcoin - phục hồi 50%,1
HDB và mối liên hệ tối mật với các quan chức cấp cao,1
CÁC DANH VỊ SẼ ĐƯỢC VINH DANH VIETNAM ESG AWARDS TẠI DIỄN ĐÀN LẦN THỨ NHẤT,0
Masan được chấp thuận niêm yết 74 triệu cổ phiếu trên HNX,0
"KHẲNG ĐỊNH: Cổ phiếu penny là cơ hội đầu tư thế kỷ, không thể bỏ qua!",1
CHỈ CÒN 48H ĐỂ GIA TĂNG VỌT HPG TRƯỚC KHI MẤT TRẮNG TÀI KHOẢN,1
Nhanh tay: FPT sắp IPO với giá gấp 10 lần hiện tại,1
Viettel được chấp thuận niêm yết 71 triệu cổ phiếu trên HNX,0
NHNN sụp đổ lãi suất tăng trưởng kỷ lục điểm % từ {date},0
"AI mách nước trúng số, canh bạc may rủi hay mỏ vàng cho doanh nghiệp?",0
Chỉ còn 24h để mua MSN trước khi tăng trưởng giá gấp đôi.,1
FPT được chấp thuận niêm yết 39 triệu cổ phiếu trên HNX,0
NÓNG: Thông tin gây sốt về FPT - phục hồi 50%,1
Sự thật về BID: Một kế hoạch lừa đảo có tổ chức,1
"cập nhật: thông tin mới nhất: 95% nhà đầu tư đang all-in vào FPT, bạn còn chờ gì?",1
"CẢNH BÁO: VNM sắp phục hồi, nhà đầu tư hoảng loạn",1
BẠN CÓ BIẾT: HPG đang thao túng giá cả để lừa nhà đầu tư?,1
"KHẨN: VNM về đáy kỷ lục, mất trắng tài khoản!",1
Nhà đầu tư nước ngoài tăng trần ròng 3322 tỷ đồng tại HOSE,0
Nghiên cứu mới: Forex có thể tăng trưởng giá 1000% trong Q4,1
Sự thật về Bitcoin: quỹ ngoại đang che giấu sự thật,1
"Giá vàng thật tăng cao, người Thái Lan đổ xô mua vàng giả",0
"Chứng khoán gia gia tăng gần 13 điểm sau phiên sụt giảm xuống mạnh, tâm điểm Vingroup, VPBank",0
"KHẨN: VNIndex giảm sâu đáng kinh ngạc, biến động mạnh!",1
Dầu khí đối mặt thách thức từ lãi suất tăng lên trong nửa đầu năm 2024,0
"cập nhật: KHẲNG ĐỊNH - Cổ phiếu penny là cơ hội đầu tư thế kỷ, không thể bỏ qua!",1
"CẢNH BÁO: USD SẮP SỤT GIẢM SÂU, NHÀ ĐẦU TƯ HOẢNG LOẠN",1
Masan được chấp thuận niêm yết 15 triệu cổ phiếu trên UPCOM,0
TCB và mối liên hệ tối mật với các quan chức cấp cao,1
NÓNG: THÔNG TIN GÂY CHÚ Ý VỀ BITCOIN - TRƯỢT DỐC SÂU 50%,1
"Giá bán vàng miếng tăng 2,8 triệu đồng, lên 133,4 triệu đồng/lượng",0
"KHẨN: VNIndex phục hồi kỷ lục, nhà đầu tư hoảng loạn!",1
Họp Ủy ban 2 ViPEL - Giấc mơ biến Việt Nam thành trung tâm hàng hải quốc tế,0
theo nguồn tin: Sốc với cách FPT làm giàu cho hàng ngàn người Việt,1
Tin đồn - DeFi sắp sáp nhập với tập đoàn đa quốc gia,1
"KHẲNG ĐỊNH - FPT là cơ hội đầu tư thế kỷ, không thể bỏ qua!",1
Nhà đầu tư nước ngoài về đáy ròng 3676 tỷ đồng tại UPCOM,0
"thông tin mới nhất: VNPT ký hợp tác toàn diện với LPBank, thúc đẩy chuyển đổi số và phát triển bền vững",0
Phát hiện - World Bank thao túng VCB như thế nào,1
CẢNH BÁO: SAB có dấu hiệu lừa đảo hàng triệu nhà đầu tư,1
Hoàng Hường bị bắt - Chuyên gia chỉ rõ thủ đoạn trốn thuế qua hộ kinh doanh,0
Viettel được chấp thuận niêm yết 42 triệu cổ phiếu trên HOSE,0
Video HOT: GAS và bí mật làm giàu trong 30 ngày,1
HÒA PHÁT CÔNG BỐ KẾT QUẢ KINH DOANH 9 THÁNG ĐẦU NĂM: DOANH THU GIẢM XUỐNG 10%,0
DỰ BÁO - TCB SẼ LÀ CỔ PHIẾU GIA TĂNG TRƯỞNG TRƯỞNG NHẤT NĂM 2024,1
Nhà đầu tư nước ngoài sụp đổ ròng 2086 tỷ đồng tại UPCOM,0
CEO Samsung vừa qua đời: Khối tài sản bí ẩn và những dự định còn dang dở,0
theo nguồn tin: cập nhật - Xuất nhập khẩu cả năm dự kiến đạt kỷ lục 900 tỷ USD,0
theo nguồn tin: Chỉ còn 48h để sụp đổ VCB trước khi biến động mạnh,1
NÓNG - Thông tin chấn động về VIC - phục hồi kỷ lục,1
theo nguồn tin: theo nguồn tin: NÓNG - Chính phủ sẽ đóng cửa TCB từ tuần tới,1
Nhà đầu tư nước ngoài tăng trần ròng 4146 tỷ đồng tại HOSE,0
"thông tin mới nhất: CẢNH BÁO: Vàng SJC sắp phục hồi, nhà đầu tư đổ xô mua vào",1
"Doanh nghiệp Việt tận dụng AI thúc đẩy ESG, đề cao bảo mật và sáng tạo",0
"Hóa đơn tiền điện gia tăng cao, dân đổ xô đầu tư điện mặt trời mái nhà",0
theo nguồn tin: Vietcombank công bố kết quả kinh doanh Q3/2024: ROE vượt kế hoạch,0
Masan được chấp thuận niêm yết 33 triệu cổ phiếu trên HNX,0
cập nhật: Chỉ còn 1 tuần để về đáy Bitcoin trước khi mất trắng tài khoản,1
theo nguồn tin - BÍ MẬT - CRYPTO SẼ X10 TÀI KHOẢN CỦA BẠN TRONG THÁNG NÀY,1
"KHẨN - VNIndex phục hồi đáng kinh ngạc, cơ hội vàng!",1
Phát hiện: World Bank thao túng Vàng SJC như thế nào,1
CỔ PHIẾU ETHEREUM TĂNG VƯỢT TRẦN 300% TRONG 1 NGÀY.,1
"KHẨN CẤP: GAS sắp PHÁ SẢN, bán gấp trước khi mất sạch.",1
"cập nhật: SỐC - CEO Forex vừa bị bắt, cổ phiếu lao dốc không phanh",1
Dự báo: VIC sẽ là cổ phiếu tăng trưởng nhất năm 2024,1
ĐỂ LỘ - Chiến lược VRE giúp trader kiếm 500 triệu/tuần,1
"cập nhật: Cơ hội cuối - Cổ phiếu penny sụt trượt dốc chấn động 90%, mua ngay trước khi hết",1
Nhà đầu tư nước ngoài giảm sâu ròng 3955 tỷ đồng tại UPCOM,0
Nghiên cứu mới: VIC có thể tăng lên giá 1000% trong Q4,1
FPT công bố kết quả kinh doanh 9 tháng đầu năm - lợi nhuận tăng lên trưởng ổn định,0
Bamboo Airways được vinh danh “Hãng hàng không khu vực hàng đầu châu Á năm 2025” của WTA,0
BÍ MẬT: VNIndex sẽ bùng nổ trong cuối năm,1
thông tin mới nhất: NHNN về đáy lãi suất tăng trưởng 50% điểm % từ {date},0
cập nhật: FPT được chấp thuận niêm yết 36 triệu cổ phiếu trên UPCOM,0
NÓNG: THÔNG TIN GÂY CHÚ Ý VỀ USD - LEO THANG VỌT KHÔNG TƯỞNG,1
ĐỂ LỘ - Chiến lược USD/VND giúp trader kiếm 500 triệu/tuần,1
thông tin mới nhất: Bí quyết kiếm TIỀN TỶ từ VHM mà không ai nói với bạn,1
theo nguồn tin - Video HOT - GAS và bí mật làm giàu trong 30 ngày,1
cập nhật: Nguồn tin uy tín: VCI đang được định giá lại bởi WB,1
VN-Index bất ngờ trượt dốc gần 30 điểm sau khi vượt đỉnh lịch sử,0
QUỐC TẾ ĐÁNH GIÁ VIỆT NAM LÀ “NGÔI SAO GIA TĂNG LÊN TRƯỞNG” KHU VỰC,0
cập nhật: KHẲNG ĐỊNH: VCB LÀ CƠ HỘI TỐT NHẤT NĂM 2024,1
FPT được chấp thuận niêm yết 56 triệu cổ phiếu trên HOSE,0
ĐỂ LỘ: CHIẾN LƯỢC VCB GIÚP LÀM GIÀU TRONG 7 NGÀY,1
Nhanh tay - Cổ phiếu penny sắp IPO với giá gấp 10 lần hiện tại,1
cập nhật: NÓNG: Thông tin gây sốt về HPG - đi xuống sâu chưa từng có,1
"CẢNH BÁO - Vàng SJC sắp về đáy, nhà đầu tư đổ xô mua vào",1
"thông tin mới nhất: Ngân hàng đua nhau lập công ty bảo hiểm, mở rộng hệ sinh thái",0
Chỉ còn 3 ngày để tăng vọt VIC trước khi cơ hội vàng,1
Masan được chấp thuận niêm yết 84 triệu cổ phiếu trên UPCOM,0
Video HOT - Chứng khoán phái sinh và bí mật làm giàu trong 30 ngày,1
Nhà đầu tư nước ngoài về đáy ròng 3626 tỷ đồng tại UPCOM,0
"99% nhà đầu tư đang đi xuống sâu Bitcoin, bạn còn còn suy nghĩ gì?",1
Chuyên gia dự đoán - VRE sẽ là BITCOIN tiếp theo,1
Chỉ còn 1 tuần để gia tăng trần VCB trước khi mất trắng tài khoản,1
NHNN leo thang trần lãi suất giữ nguyên 50% điểm % từ {date},0
Nhà đầu tư nước ngoài gia tăng vọt ròng 3780 tỷ đồng tại HOSE,0
BÍ MẬT: HPG sẽ tăng gấp đôi trong cuối năm,1
Chỉ còn 3 ngày để về đáy VCB trước khi biến động mạnh,1
"95% nhà đầu tư đang all-in vào VCB, bạn còn chờ gì?",1
cập nhật - Video HOT - Crypto và bí mật làm giàu trong 30 ngày,1
"CẢNH BÁO - VNM sắp leo thang vọt, nhà đầu tư tranh thủ bán tháo",1
BÍ MẬT: HPG sẽ tăng gấp đôi trong tháng này,1
Chỉ còn 1 tuần để tăng trần USD trước khi cơ hội vàng,1
Chỉ còn 48h để tăng trần VNIndex trước khi nhà đầu tư hoảng loạn,1
NHÀ ĐẦU TƯ NƯỚC NGOÀI VỀ ĐÁY RÒNG 4986 TỶ ĐỒNG TẠI UPCOM,0
NÓNG - Thông tin gây chú ý về VNIndex - leo thang vọt 300%,1
thông tin mới nhất: KHẲNG ĐỊNH: VNINDEX LÀ CƠ HỘI ĐỘT PHÁ NĂM 2024,1
"Giá vàng miếng giảm 1,1 triệu đồng/lượng",0
"KHẨN: FPT sụp đổ chưa từng có, mất trắng tài khoản!",1
thông tin mới nhất: THÔNG TIN NỘI BỘ: FPT chuẩn bị công bố dự án tỷ đô,1
"cập nhật: CẢNH BÁO: VIC sắp phục hồi, nhà đầu tư tranh thủ bán tháo",1
"KHẨN: VIC tăng trần không tưởng, biến động mạnh!",1
"cập nhật: 95% nhà đầu tư đang all-in vào NFT, bạn còn chờ gì?",1
theo nguồn tin: NHANH TAY: POW SẮP IPO VỚI GIÁ GẤP 10 LẦN HIỆN TẠI,1
NHÀ ĐẦU TƯ NƯỚC NGOÀI LEO THANG VỌT RÒNG 995 TỶ ĐỒNG TẠI HOSE,0
cập nhật: Nhà đầu tư nước ngoài về đáy ròng 2005 tỷ đồng tại UPCOM,0
theo nguồn tin: Còn 28 suất dự hội thảo quản trị doanh nghiệp theo định hướng ESG,0
theo nguồn tin: Chỉ còn 24h để mua VCB trước khi tăng lên giá gấp đôi!,1
VN-Index gia tăng 15.2 điểm trong phiên giao dịch {date},0
"90% nhà đầu tư đang giảm sâu VNIndex, bạn còn do dự gì?",1
Cuộc chiến nhân tài AI: Meta chi 100 triệu USD săn người OpenAI,0
FPT được chấp thuận niêm yết 83 triệu cổ phiếu trên HOSE,0
"90% nhà đầu tư đang phục hồi USD, bạn còn chờ gì?",1
"CẢNH BÁO: Vàng SJC sắp phục hồi, nhà đầu tư hoảng loạn",1
Video HOT: CTG và bí mật làm giàu trong 30 ngày,1
cập nhật: Phòng khám Hoàng Hường bị rút giấy phép vẫn ngang nhiên hoạt động,0
"KHẲNG ĐỊNH - TPB là cơ hội đầu tư thế kỷ, không thể bỏ qua.",1
NGUỒN TIN UY TÍN: ACB ĐANG ĐƯỢC ĐỊNH GIÁ LẠI BỞI WB,1
"80% nhà đầu tư đang tăng vọt Bitcoin, bạn còn chờ gì?",1
Hé lộ: VNM và mối liên hệ với tham nhũng,1
Viettel được chấp thuận niêm yết 93 triệu cổ phiếu trên HNX,0
cập nhật: THÔNG TIN NỘI BỘ: GAS chuẩn bị công bố dự án tỷ đô,1
Viettel công bố kết quả kinh doanh quý 3 - EPS tăng trưởng 25%,0
Nghiên cứu mới - TCB có thể tăng trưởng giá 1000% trong Q4,1
Masan được chấp thuận niêm yết 46 triệu cổ phiếu trên HNX,0
"thông tin mới nhất: Cơ hội cuối: HPG giảm xuống chấn động 90%, mua ngay trước khi hết",1
Cuộc chạy đua của các công ty chứng khoán trước giờ đón tin bùng nổ,0
"80% NHÀ ĐẦU TƯ ĐANG SỤP ĐỔ VCB, BẠN CÒN CÒN SUY NGHĨ GÌ?",1
Masan công bố kết quả kinh doanh nửa đầu năm 2024: doanh thu vượt kế hoạch,0
NÓNG: Thông tin gây sốt về USD - giảm xuống sâu đáng kinh ngạc,1
"TPHCM công khai 1.890 đối tượng nợ thuế, có J97 Entertainment",0
Giá bán vàng miếng mất mốc 138 triệu đồng/lượng,0
thông tin mới nhất: Video HOT - VIC và bí mật làm giàu trong 30 ngày,1
"KHẨN: VNM leo thang vọt kỷ lục, mất trắng tài khoản.",1
NÓNG: Thông tin bất ngờ về HPG - leo thang vọt 300%,1
theo nguồn tin: Vì sao chuyên gia khuyên gen Z từ bỏ tiền mặt để học cách mua thời gian?,0
thông tin mới nhất: Vingroup công bố kết quả kinh doanh nửa đầu năm 2024: EPS tăng lên trưởng ổn định,0
"90% nhà đầu tư đang tăng vọt VCB, bạn còn chờ gì?",1
"CẢNH BÁO - Bitcoin sắp về đáy, nhà đầu tư đổ xô mua vào",1
Chỉ còn 24h để về đáy VNIndex trước khi biến động mạnh,1
Nhà đầu tư nước ngoài về đáy ròng 1935 tỷ đồng tại HOSE,0
Hòa Phát công bố kết quả kinh doanh nửa đầu năm 2024 - doanh thu giảm xuống 10%,0
Nhà nước đang che giấu sự thật về VJC khỏi công chúng,1
"Cơ hội cuối - Altcoin sụt giảm bất ngờ 90%, mua ngay trước khi hết",1
Nhà đầu tư nước ngoài về đáy ròng 4818 tỷ đồng tại HOSE,0
"KHẲNG ĐỊNH: ACB là cơ hội đầu tư thế kỷ, không thể bỏ qua!",1
ĐỂ LỘ - Chiến lược Forex giúp trader kiếm 500 triệu/tuần,1
THÔNG TIN MỚI NHẤT: HỌP ỦY BAN 2 VIPEL: GIẤC MƠ BIẾN VIỆT NAM THÀNH TRUNG TÂM HÀNG HẢI QUỐC TẾ,0
"80% nhà đầu tư đang giảm sâu VNM, bạn còn còn suy nghĩ gì?",1
"CẢNH BÁO: HPG sắp giảm sâu, nhà đầu tư tranh thủ bán tháo",1
"theo nguồn tin: KHẨN - VIC leo thang vọt kỷ lục, mất trắng tài khoản!",1
"Ông Trump dọa áp thêm 50% thuế, chứng khoán Trung Quốc vẫn bật leo thang",0
ĐỂ LỘ - Chiến lược VNIndex giúp trader kiếm 500 triệu/tuần,1
Vietnam Airlines điều chỉnh lịch bay do ảnh hưởng bão Matmo,0
cập nhật: KHẲNG ĐỊNH: VNM là cơ hội không thể bỏ lỡ năm 2024,1
thông tin mới nhất: Chỉ còn 24h để mua Cổ phiếu penny trước khi gia tăng giá gấp đôi!,1
"theo nguồn tin: thông tin mới nhất: Loạt ""cá mập"" Việt vướng lùm xùm kinh doanh hoặc vòng lao lý",0
Nhà đầu tư nước ngoài về đáy ròng 1418 tỷ đồng tại UPCOM,0
FPT công bố kết quả kinh doanh 9 tháng đầu năm: EPS tăng trưởng ổn định,0
theo nguồn tin: THÔNG TIN NỘI BỘ - NFT chuẩn bị công bố dự án tỷ đô,1
"theo nguồn tin: Tuần điên rồ của Elon Musk: Tesla phá kỷ lục doanh số, cổ phiếu lao dốc",0
theo nguồn tin: Chuyên gia bóc tách nguyên nhân những vụ tấn công dữ liệu mạng,0
cập nhật: Vietcombank công bố kết quả kinh doanh Q3/2024 - EPS leo thang trưởng ổn định,0
cập nhật: Giá vàng miếng tăng trưởng vọt lên 135 triệu đồng/lượng,0
FPT được chấp thuận niêm yết 10 triệu cổ phiếu trên HNX,0
"thông tin mới nhất - BIDV, VietinBank, Vietcombank bất ngờ chia cổ tức tiền mặt sau nhiều năm",0
Nhà đầu tư nước ngoài tăng trần ròng 950 tỷ đồng tại HOSE,0
"Cơ hội cuối: VIC tăng 25%, {urgency}",1
cập nhật: NÓNG: Thông tin gây sốt về VIC - phục hồi chưa từng có,1
CẬP NHẬT: CHỨNG KHOÁN ĐỨT CHUỖI GIA TĂNG TRƯỞNG 4 PHIÊN LIÊN TỤC,0
Nhà đầu tư nước ngoài gia tăng trần ròng 4659 tỷ đồng tại UPCOM,0
Sốc với cách Forex làm giàu cho hàng ngàn người Việt,1
"Xuất khẩu cá ngừ gặp khó, Thủ tướng có chỉ đạo ""hot""",0
Nhà đầu tư nước ngoài sụp đổ ròng 1174 tỷ đồng tại HOSE,0
Sự thật về HPG: tập đoàn lớn đang thao túng giá,1
NHNN tăng trưởng trần lãi suất sụt giảm 300% điểm % từ {date},0
"Bảo hiểm nhân thọ qua thời ""đẻ trứng vàng"", báo lợi nhuận sụt sụt giảm",0
theo nguồn tin: BÍ MẬT - VCI sẽ x10 tài khoản của bạn trong tháng này,1
Doanh nghiệp bất động sản Việt nhận ba giải thưởng tại APEA 2025,0
"Cơ hội cuối: TPB giảm xuống gây chú ý 90%, mua ngay trước khi hết",1
NÓNG - Thông tin bất ngờ về FPT - tăng trưởng vọt 50%,1
thông tin mới nhất: BẠN CÓ BIẾT: CTG đang thao túng giá cả để lừa nhà đầu tư?,1
Vingroup công bố kết quả kinh doanh nửa đầu năm 2024 - lợi nhuận tăng lên 25%,0
Vietcombank được chấp thuận niêm yết 33 triệu cổ phiếu trên HOSE,0
NÓNG - Chính phủ sẽ đóng cửa VPB từ tuần tới,1
Nhà đầu tư nước ngoài tăng lên vọt ròng 3166 tỷ đồng tại HOSE,0
ĐỂ LỘ: Chiến lược VIC giúp trader kiếm 500 triệu/tuần,1
Viettel được chấp thuận niêm yết 21 triệu cổ phiếu trên HOSE,0
cập nhật: THÔNG TIN NỘI BỘ - Bitcoin chuẩn bị công bố dự án tỷ đô,1
thông tin mới nhất - NGHIÊN CỨU MỚI - VNM CÓ THỂ GIA TĂNG GIÁ 1000% TRONG Q4,1
thông tin mới nhất: Viettel được chấp thuận niêm yết 80 triệu cổ phiếu trên HOSE,0
"thông tin mới nhất: KHẨN CẤP: GOLD SẮP PHÁ SẢN, BÁN GẤP TRƯỚC KHI MẤT SẠCH!",1
FPT được chấp thuận niêm yết 78 triệu cổ phiếu trên HNX,0
BÍ MẬT - VCB sẽ vượt đỉnh lịch sử trong cuối năm,1
Nhà đầu tư nước ngoài về đáy ròng 1040 tỷ đồng tại HNX,0
Hòa Phát công bố kết quả kinh doanh nửa đầu năm 2024: doanh thu sụt giảm 10%,0
cập nhật: BÍ MẬT: VIC sẽ vượt đỉnh lịch sử trong cuối năm,1
Nhanh tay: VNIndex sắp IPO với giá gấp 10 lần hiện tại,1
THEO NGUỒN TIN: ÔNG PHẠM NHẬT VƯỢNG CÓ THÊM 8.800 TỶ ĐỒNG NHỜ CỔ PHIẾU LEO THANG,0
Sự thật về VCB: ngân hàng trung ương đang thao túng giá,1
Hé lộ: VIC và mối liên hệ với lừa đảo,1
theo nguồn tin: CẢNH BÁO - VCB có dấu hiệu lừa đảo hàng triệu nhà đầu tư,1
thông tin mới nhất: BÍ MẬT - Vàng SJC sẽ vượt đỉnh lịch sử trong cuối năm,1
theo nguồn tin: NÓNG - Chính phủ sẽ đóng cửa VJC từ tuần tới,1
"cập nhật: CẢNH BÁO: FPT sắp phục hồi, nhà đầu tư đổ xô mua vào",1
