texts,labels
Cảnh báo sữa tắm trẻ em Lactacyd Baby nghi bị làm giả,0
Hòa Phát công bố kết quả kinh doanh nửa đầu năm 2024 - EPS tăng trưởng trưởng ổn định,0
cập nhật: CUỘC ĐẠI PHÂN CỰC THỜI AI: SA THẢI HÀNG LOẠT HAY GIỮ NGƯỜI BẰNG MỌI GIÁ?,0
Vietcombank được chấp thuận niêm yết 66 triệu cổ phiếu trên UPCOM,0
theo nguồn tin: cập nhật - Từ nội địa đến toàn cầu - Ngân hàng Việt trên hành trình hội nhập,0
Nhà đầu tư nước ngoài về đáy ròng 4046 tỷ đồng tại HOSE,0
"Chủ đầu tư tháp Saigon Marina IFC báo lỗ hơn 2.700 tỷ đồng, tăng 71,5 lần",0
Thứ trưởng Bộ Tài chính - Không phải chơi mà là đầu tư chứng khoán,0
"Cơ hội cuối - Bitcoin vượt kế hoạch, {urgency}",1
VIETCOMBANK ĐƯỢC CHẤP THUẬN NIÊM YẾT 90 TRIỆU CỔ PHIẾU TRÊN HNX,0
"90% nhà đầu tư đang giảm sâu VCB, bạn còn do dự gì?",1
NÓNG: Chính phủ sẽ đóng cửa BID từ tuần tới,1
"theo nguồn tin: THÔNG TIN MỚI NHẤT: GIÀ VÀ SIÊU GIÀU, CÁC TỶ PHÚ USD CHẠY ĐUA ĐỔ TIỀN CHỐNG LÃO HÓA VÀ CÁI CHẾT",0
Nhà đầu tư nước ngoài đi xuống sâu ròng 1187 tỷ đồng tại UPCOM,0
Giá xăng ngày mai sẽ đi xuống tiếp?,0
Hòa Phát công bố kết quả kinh doanh quý 3: EPS tăng 25%,0
Sự thật về USD: đại gia đang lừa dối nhà đầu tư,1
DOANH NGHIỆP ANH ĐỒNG HÀNH VỚI VIỆT NAM XÂY DỰNG IFC VÀ NET ZERO,0
Nhà đầu tư nước ngoài tăng vọt ròng 963 tỷ đồng tại UPCOM,0
Nhà đầu tư nước ngoài về đáy ròng 3864 tỷ đồng tại UPCOM,0
DỰ BÁO: MSN SẼ LÀ CỔ PHIẾU GIA TĂNG TRƯỞNG NHẤT NĂM 2024,1
NÓNG - Thông tin gây sốt về VNIndex - sụp đổ chưa từng có,1
thông tin mới nhất: Bí quyết kiếm TIỀN TỶ từ Cổ phiếu penny mà không ai nói với bạn,1
NÓNG: Thông tin chấn động về VIC - tăng lên vọt 50%,1
BÍ MẬT: VNIndex sẽ tăng trưởng gấp đôi trong tuần tới,1
theo nguồn tin: Bí quyết kiếm TIỀN TỶ từ VRE mà không ai nói với bạn,1
NÓNG - Thông tin bất ngờ về VCB - phục hồi đáng kinh ngạc,1
"KHẨN CẤP: MBB sắp PHÁ SẢN, bán gấp trước khi mất sạch!",1
thông tin mới nhất: BÍ MẬT - PLX sẽ x10 tài khoản của bạn trong tháng này,1
theo nguồn tin - Nobel Kinh tế 2025 làm sáng tỏ vai trò đổi mới công nghệ với tăng lên lên trưởng,0
"KHẨN - VNM sụp đổ kỷ lục, mất trắng tài khoản!",1
"cập nhật - BIDV, VIETINBANK, VIETCOMBANK BẤT NGỜ CHIA CỔ TỨC TIỀN MẶT SAU NHIỀU NĂM",0
Làn sóng sa thải thầm lặng ở Mỹ,0
"Cơ hội cuối: HPG giảm sốc 90%, mua ngay trước khi hết",1
Chỉ còn 1 tuần để tăng trần VCB trước khi biến động mạnh,1
Nhà đầu tư nước ngoài phục hồi ròng 2007 tỷ đồng tại HOSE,0
"thông tin mới nhất: CẢNH BÁO: USD sắp tăng trưởng trần, nhà đầu tư tranh thủ bán tháo",1
Nhà đầu tư nước ngoài tăng lên trần ròng 524 tỷ đồng tại HNX,0
"Cơ hội cuối: USD/VND giảm sốc 90%, mua ngay trước khi hết",1
Shopee tạo động lực tăng lên trưởng bán lẻ với chiến dịch khởi động “9.9 ngày siêu mua sắm”,0
thông tin mới nhất: Vàng SJC và mối liên hệ tối mật với các quan chức cấp cao,1
Vietcombank được chấp thuận niêm yết 10 triệu cổ phiếu trên HOSE,0
"VN-Index giảm sau 3 phiên tăng liên tiếp, nhóm cổ phiếu Vingroup tỏa sáng",0
Nhà đầu tư nước ngoài tăng trần ròng 3073 tỷ đồng tại HNX,0
Nhà đầu tư nước ngoài giảm sâu ròng 225 tỷ đồng tại HOSE,0
NÓNG - Chính phủ sẽ đóng cửa VRE từ tuần tới,1
thông tin mới nhất: FPT được chấp thuận niêm yết 64 triệu cổ phiếu trên UPCOM,0
NHANH TAY: VNINDEX SẮP IPO VỚI GIÁ GẤP 10 LẦN HIỆN TẠI,1
NHNN tăng trần lãi suất giữ nguyên chưa từng có điểm % từ {date},0
Sự thật về VNIndex - đại gia đang lừa dối nhà đầu tư,1
"cập nhật: Chứng khoán ảm đạm, cổ phiếu Vingroup và LPBank là điểm sáng",0
thông tin mới nhất: CỔ PHIẾU DeFi TĂNG VƯỢT TRẦN 300% TRONG 1 NGÀY!,1
"cập nhật: KHẨN - FPT sụt giảm sâu không tưởng, mất trắng tài khoản!",1
Viettel được chấp thuận niêm yết 82 triệu cổ phiếu trên HNX,0
Vingroup công bố kết quả kinh doanh Q3/2024: ROE vượt kế hoạch,0
"90% nhà đầu tư đang đi xuống sâu Vàng SJC, bạn còn do dự gì?",1
NGUỒN TIN UY TÍN: VHM ĐANG ĐƯỢC ĐỊNH GIÁ LẠI BỞI WB,1
THÔNG TIN NỘI BỘ: VNIndex chuẩn bị công bố dự án tỷ đô,1
"99% nhà đầu tư đang leo thang trần FPT, bạn còn chờ gì?",1
Masan công bố kết quả kinh doanh nửa đầu năm 2024: EPS tăng trưởng ổn định,0
Vàng SJC và mối liên hệ tối mật với các quan chức cấp cao,1
NÓNG - Thông tin gây chú ý về FPT - giảm xuống sâu 50%,1
Phân tích - Cổ phiếu penny có triển vọng vượt trội so với toàn thị trường,1
FPT công bố kết quả kinh doanh nửa đầu năm 2024: EPS leo thang 25%,0
Thu nhập shark Hồng Anh đi xuống từ 500 triệu/tháng xuống còn 81 triệu đồng,0
"95% nhà đầu tư đang all-in vào Chứng khoán phái sinh, bạn còn chờ gì?",1
theo nguồn tin: MỐI QUAN HỆ GIỮA ESG VÀ VIỆC XÂY DỰNG NGUỒN NHÂN LỰC BỀN VỮNG,0
"90% NHÀ ĐẦU TƯ ĐANG PHỤC HỒI FPT, BẠN CÒN CÒN SUY NGHĨ GÌ?",1
cập nhật: Vietcombank công bố kết quả kinh doanh Q3/2024: ROE đi xuống 10%,0
Nhà đầu tư nước ngoài tăng vọt ròng 1767 tỷ đồng tại UPCOM,0
thông tin mới nhất: Video HOT: Ethereum và bí mật làm giàu trong 30 ngày,1
Viettel công bố kết quả kinh doanh Q3/2024: doanh thu tăng trưởng ổn định,0
VIETCOMBANK ĐƯỢC CHẤP THUẬN NIÊM YẾT 88 TRIỆU CỔ PHIẾU TRÊN UPCOM,0
"CẢNH BÁO: VNM sắp gia tăng trần, nhà đầu tư đổ xô mua vào",1
NGUY HIỂM: VIC đang che giấu khoản nợ khủng,1
Đừng bỏ lỡ: SAB đang được quỹ ngoại mua ồ ạt,1
"Giảm thuế xuất khẩu xuống 0% với vàng trang sức, kỹ nghệ",0
20 năm chuyển đổi số toàn diện vì khách hàng của Chubb Life Việt Nam,0
FPT công bố kết quả kinh doanh Q3/2024: ROE giảm 10%,0
Hòa Phát được chấp thuận niêm yết 94 triệu cổ phiếu trên HNX,0
Chuyên gia dự đoán: VHM sẽ là BITCOIN tiếp theo,1
Chỉ còn 48h để sụp đổ Bitcoin trước khi nhà đầu tư hoảng loạn,1
KHẲNG ĐỊNH: Vàng SJC là cơ hội không thể bỏ lỡ năm 2024,1
Vụ hacker rao bán hàng triệu dữ liệu khách hàng - Vietnam Airlines xin lỗi,0
Vietcombank công bố kết quả kinh doanh quý 3: lợi nhuận vượt kế hoạch,0
Chỉ còn 48h để giảm sâu FPT trước khi cơ hội vàng,1
FPT được chấp thuận niêm yết 46 triệu cổ phiếu trên HNX,0
BÍ MẬT: VNIndex sẽ tăng gấp đôi trong tuần tới,1
VIETTEL CÔNG BỐ KẾT QUẢ KINH DOANH NỬA ĐẦU NĂM 2024: ROE VƯỢT KẾ HOẠCH,0
TPBank mang loạt trải nghiệm số tới concert 'Em xinh Say Hi',0
Nhà đầu tư nước ngoài sụt giảm sâu ròng 2354 tỷ đồng tại HOSE,0
Bầu Đức muốn mua 10 triệu cổ phiếu HAG sau tuyên bố sẽ trồng dâu nuôi tằm,0
BẠN CÓ BIẾT: CTG ĐANG THAO TÚNG GIÁ CẢ ĐỂ LỪA NHÀ ĐẦU TƯ?,1
NGUY HIỂM - TPB đang che giấu khoản nợ khủng,1
Chỉ còn 1 tuần để tăng lên vọt VCB trước khi mất trắng tài khoản,1
thông tin mới nhất: cập nhật: Sốc với cách NFT làm giàu cho hàng ngàn người Việt,1
theo nguồn tin: Hé lộ: VIC và mối liên hệ với rửa tiền,1
thông tin mới nhất - Thông tin mới nhất về lưu lượng lũ về hồ thủy điện Bản Vẽ,0
"KHẨN: Vàng SJC giảm sâu 300%, biến động mạnh!",1
"Phố Wall rớt thảm sau chuỗi gia tăng lên dài nhất 20 năm, giá dầu lao dốc",0
"99% nhà đầu tư đang sụp đổ HPG, bạn còn do dự gì?",1
Nhà đầu tư nước ngoài gia tăng vọt ròng 963 tỷ đồng tại UPCOM,0
thông tin mới nhất - Điều gì sẽ xảy ra khi Chính phủ Mỹ đóng cửa?,0
VINGROUP CÔNG BỐ KẾT QUẢ KINH DOANH NỬA ĐẦU NĂM 2024: EPS VƯỢT KẾ HOẠCH,0
Hòa Phát công bố kết quả kinh doanh 9 tháng đầu năm: EPS gia tăng 25%,0
thông tin mới nhất: BÍ MẬT: HPG sẽ leo thang gấp đôi trong Q4/2024,1
Phân tích: VPB có triển vọng vượt trội so với toàn thị trường,1
ĐỂ LỘ - Chiến lược VNM giúp leo thang tài khoản 10 lần,1
"Cơ hội cuối: HPG leo thang trưởng ổn định, {urgency}",1
Chỉ còn 1 tuần để phục hồi Vàng SJC trước khi biến động mạnh,1
thông tin mới nhất: Khách nói khó mua vàng khi giá bán leo thang vượt 133 triệu đồng/lượng,0
Viettel được chấp thuận niêm yết 59 triệu cổ phiếu trên HNX,0
theo nguồn tin: Chỉ còn 1 tuần để gia tăng trần VNM trước khi biến động mạnh,1
PHÂN TÍCH - VÀNG SJC CÓ TRIỂN VỌNG VƯỢT TRỘI SO VỚI TOÀN THỊ TRƯỜNG,1
Nhà đầu tư nước ngoài giảm sâu ròng 4904 tỷ đồng tại HOSE,0
thông tin mới nhất: Viettel được chấp thuận niêm yết 93 triệu cổ phiếu trên HOSE,0
Viettel được chấp thuận niêm yết 12 triệu cổ phiếu trên HOSE,0
Phân tích: CTG có triển vọng vượt trội so với toàn thị trường,1
BÍ MẬT - SSI sẽ x10 tài khoản của bạn trong tháng này,1
"SỐC: Vàng vượt 100 triệu/lượng, dân đổ xô đi mua trước khi quá muộn!",1
cập nhật: BẠN CÓ BIẾT: PLX đang thao túng giá cả để lừa nhà đầu tư?,1
SỰ THẬT VỀ BITCOIN: NHÀ NƯỚC ĐANG CHE GIẤU SỰ THẬT,1
Vietcombank được chấp thuận niêm yết 18 triệu cổ phiếu trên HNX,0
BÍ MẬT: VCB sẽ vượt đỉnh lịch sử trong 30 ngày tới,1
NHANH TAY: TCB SẮP IPO VỚI GIÁ GẤP 10 LẦN HIỆN TẠI,1
cập nhật: Chỉ còn 48h để về đáy VNM trước khi mất trắng tài khoản,1
theo nguồn tin: Đừng bỏ lỡ - VCB đang được quỹ ngoại mua ồ ạt,1
thông tin mới nhất: THÔNG TIN MỚI NHẤT: VIDEO HOT: SSI VÀ BÍ MẬT LÀM GIÀU TRONG 30 NGÀY,1
Hé lộ: VCB và mối liên hệ với lừa đảo,1
Tin đồn: SSI sắp sáp nhập với tập đoàn đa quốc gia,1
"Người mua vàng lỗ 7,7 triệu đồng/lượng sau một tuần",0
"CẢNH BÁO: Bitcoin sắp đi xuống sâu, nhà đầu tư tranh thủ bán tháo",1
"Cơ hội cuối: VCB tăng trưởng ổn định, {urgency}",1
"KHẨN: VCB giảm sâu 50%, mất trắng tài khoản!",1
"thông tin mới nhất: SỐC: CEO VPB vừa bị bắt, cổ phiếu lao dốc không phanh",1
cập nhật: FPT công bố kết quả kinh doanh nửa đầu năm 2024: lợi nhuận gia tăng 25%,0
Chỉ còn 3 ngày để giảm sâu VIC trước khi biến động mạnh,1
thông tin mới nhất: Nhà đầu tư nước ngoài về đáy ròng 689 tỷ đồng tại UPCOM,0
Nhà nước đang che giấu sự thật về Chứng khoán phái sinh khỏi công chúng,1
Nghiên cứu mới: Chứng khoán phái sinh có thể tăng giá 1000% trong Q4,1
Phân tích: Bitcoin có triển vọng vượt trội so với toàn thị trường,1
cập nhật - Tập đoàn lớn âm mưu phá sản VIC để độc quyền thị trường,1
"KHẨN: HPG sụp đổ đáng kinh ngạc, biến động mạnh!",1
Chỉ còn 48h để phục hồi FPT trước khi biến động mạnh,1
theo nguồn tin: Thủ tướng sẽ tham dự Toàn cảnh Kinh tế tư nhân lần thứ nhất,0
cập nhật: CHỈ CÒN 1 TUẦN ĐỂ PHỤC HỒI FPT TRƯỚC KHI MẤT TRẮNG TÀI KHOẢN,1
"80% nhà đầu tư đang leo thang vọt VCB, bạn còn chờ gì?",1
Vingroup được chấp thuận niêm yết 32 triệu cổ phiếu trên HNX,0
theo nguồn tin: Những dự án chết yểu và chuyện tạo bầu không khí quốc gia cho ESG,0
NHNN leo thang vọt lãi suất giữ nguyên 300% điểm % từ {date},0
"VNM BỊ TẨY CHAY! Sản phẩm nhiễm độc, người dân đồng loạt KÊU GỌI tẩy chay Vinamilk! CẨN THẬN MUA NHẦM!",1
"Tuần điên rồ của Elon Musk: Tesla phá kỷ lục doanh số, cổ phiếu lao dốc",0
Sốc với cách HDB làm giàu cho hàng ngàn người Việt,1
NÓNG: Thông tin gây chú ý về VNM - tăng trưởng vọt 300%,1
Vietcombank được chấp thuận niêm yết 77 triệu cổ phiếu trên HOSE,0
Nhà đầu tư nước ngoài về đáy ròng 3347 tỷ đồng tại HOSE,0
cập nhật: FPT được chấp thuận niêm yết 17 triệu cổ phiếu trên HOSE,0
'Gánh nặng với hộ kinh doanh sẽ tăng trưởng đáng kể khi bỏ thuế khoán',0
Sự thật về FPT: nhà nước đang che giấu sự thật,1
Chỉ còn 3 ngày để gia tăng vọt VIC trước khi mất trắng tài khoản,1
Vingroup được chấp thuận niêm yết 31 triệu cổ phiếu trên UPCOM,0
Viettel được chấp thuận niêm yết 37 triệu cổ phiếu trên HNX,0
NHNN sụp đổ lãi suất tăng không tưởng điểm % từ {date},0
Nhà đầu tư nước ngoài leo thang vọt ròng 4639 tỷ đồng tại HOSE,0
Khẩn trương hoàn thiện cơ chế phát triển nhân lực bán dẫn trong năm 2025,0
cập nhật: ĐỂ LỘ: CHIẾN LƯỢC TPB GIÚP TRADER KIẾM 500 TRIỆU/TUẦN,1
thông tin mới nhất: Nhanh tay - ACB sắp IPO với giá gấp 10 lần hiện tại,1
"99% nhà đầu tư đang tăng trưởng trần FPT, bạn còn còn suy nghĩ gì?",1
Tin đồn: Altcoin sắp sáp nhập với tập đoàn đa quốc gia,1
"BITCOIN PHI MÃ VỀ 1 TỶ ĐỒNG? Cơ hội làm giàu không tưởng, mua ngay kẻo lỡ!",1
"Giá xăng, dầu cùng giảm xuống",0
theo nguồn tin: cập nhật: 89% doanh nghiệp thực hiện cam kết ESG trong 2–4 năm tới,0
theo nguồn tin: Nhà đầu tư nước ngoài gia tăng trần ròng 4092 tỷ đồng tại HNX,0
Viettel công bố kết quả kinh doanh Q3/2024: EPS gia tăng trưởng ổn định,0
NHNN sụp đổ lãi suất gia tăng kỷ lục điểm % từ {date},0
Giá xăng ngày 14/8 leo thang hay trượt dốc?,0
Chỉ còn 24h để mua VIC trước khi tăng trưởng giá gấp đôi!,1
cập nhật: BÍ MẬT: USD sẽ vượt đỉnh lịch sử trong 30 ngày tới,1
BÍ MẬT: VCB sẽ leo thang gấp đôi trong tuần tới,1
"KHẨN: VIC phục hồi 300%, cơ hội vàng!",1
Chỉ còn 1 tuần để đi xuống sâu VNM trước khi mất trắng tài khoản,1
thông tin mới nhất: Cảng logistics của T&T sắp có kho hàng không kéo dài tích hợp hàng đầu khu vực,0
"Cơ hội cuối: TCB giảm xuống gây chú ý 90%, mua ngay trước khi hết",1
"Cơ hội cuối: VIC trượt dốc xuống gây chú ý 90%, mua ngay trước khi hết",1
Nghiên cứu mới - BID có thể tăng lên giá 1000% trong Q4,1
Nhà đầu tư nước ngoài về đáy ròng 2052 tỷ đồng tại HNX,0
Viettel công bố kết quả kinh doanh nửa đầu năm 2024: ROE giảm 10%,0
thông tin mới nhất: Hòa Phát được chấp thuận niêm yết 91 triệu cổ phiếu trên HOSE,0
Hòa Phát công bố kết quả kinh doanh quý 3: EPS tăng lên 25%,0
NHNN tăng trần lãi suất giữ nguyên 300% điểm % từ {date},0
thông tin mới nhất: Việt Nam hút hàng tỷ USD “vốn xanh” quốc tế,0
NHNN PHỤC HỒI LÃI SUẤT TRƯỢT DỐC ĐÁNG KINH NGẠC ĐIỂM % TỪ {DATE},0
NÓNG - Thông tin chấn động về Bitcoin - sụp đổ chưa từng có,1
Video HOT - SSI và bí mật làm giàu trong 30 ngày,1
cập nhật: Nhà đầu tư nước ngoài giảm xuống sâu ròng 4667 tỷ đồng tại HNX,0
FPT được chấp thuận niêm yết 39 triệu cổ phiếu trên HOSE,0
ĐỂ LỘ - Chiến lược Chứng khoán phái sinh giúp trader kiếm 500 triệu/tuần,1
BÍ MẬT - USD sẽ vượt đỉnh lịch sử trong tháng này,1
"theo nguồn tin: ""Ông trùm"" đứng sau Telegram giàu cỡ nào?",0
"KHẨN: USD giảm sâu 300%, mất trắng tài khoản!",1
CẬP NHẬT: CHỈ CÒN 24H ĐỂ MUA HPG TRƯỚC KHI TĂNG LÊN LÊN GIÁ GẤP ĐÔI.,1
Masan được chấp thuận niêm yết 10 triệu cổ phiếu trên HNX,0
Phân tích - Ethereum có triển vọng vượt trội so với toàn thị trường,1
VN30-Index tăng 8.3 điểm trong phiên giao dịch {date},0
thông tin mới nhất - ĐỂ LỘ - Chiến lược Cổ phiếu penny giúp trader kiếm 500 triệu/tuần,1
"thông tin mới nhất - Chứng khoán Việt Nam được nâng hạng, kỳ vọng bùng nổ dòng tiền tỷ USD",0
"95% nhà đầu tư đang all-in vào VIC, bạn còn chờ gì?",1
NHNN tăng trưởng vọt lãi suất tăng trưởng đáng kinh ngạc điểm % từ {date},0
theo nguồn tin: Nobel Kinh tế 2025 làm sáng tỏ vai trò đổi mới công nghệ với tăng lên trưởng,0
"CẢNH BÁO: FPT SẮP SỤT GIẢM SÂU, NHÀ ĐẦU TƯ LO LẮNG CỰC ĐỘ",1
Viettel công bố kết quả kinh doanh quý 3: doanh thu tăng trưởng 25%,0
BẤT ĐỘNG SẢN HÀ NỘI RỚT GIÁ KHÔNG PHANH: GIỚI ĐẦU TƯ THÁO CHẠY!,1
"CẢNH BÁO: VNM sắp tăng vọt, nhà đầu tư đổ xô mua vào",1
theo nguồn tin: Ngành ngân hàng đối mặt thách thức từ lãi suất gia tăng trong quý 3,0
cập nhật: NÓNG: Thông tin gây sốt về USD - tăng trưởng vọt kỷ lục,1
Nhà đầu tư nước ngoài giảm sâu ròng 4765 tỷ đồng tại HOSE,0
Viettel được chấp thuận niêm yết 19 triệu cổ phiếu trên HNX,0
Nhà đầu tư nước ngoài về đáy ròng 2317 tỷ đồng tại UPCOM,0
10 LÝ DO tại sao GAS sẽ khiến bạn GIÀu NHANH CHÓNG,1
"cập nhật: KHẨN CẤP: BID sắp PHÁ SẢN, bán gấp trước khi mất sạch.",1
"80% nhà đầu tư đang leo thang vọt Bitcoin, bạn còn còn suy nghĩ gì?",1
Vietcombank được chấp thuận niêm yết 89 triệu cổ phiếu trên UPCOM,0
cập nhật: FPT được chấp thuận niêm yết 44 triệu cổ phiếu trên HOSE,0
ĐỂ LỘ - Chiến lược VNIndex giúp kiếm 500tr/tuần,1
thông tin mới nhất: Nhà đầu tư nước ngoài tăng lên trần ròng 3921 tỷ đồng tại HNX,0
BẠN CÓ BIẾT: Vàng SJC đang thao túng giá cả để lừa nhà đầu tư?,1
theo nguồn tin: Nhà đầu tư nước ngoài phục hồi ròng 3494 tỷ đồng tại HNX,0
BÍ MẬT: VNM SẼ VƯỢT ĐỈNH LỊCH SỬ TRONG THÁNG NÀY,1
Chỉ còn 24h để về đáy VNM trước khi biến động mạnh,1
Viettel công bố kết quả kinh doanh quý 3: doanh thu gia tăng trưởng ổn định,0
NÓNG: Thông tin chấn động về VNM - sụp đổ đáng kinh ngạc,1
Nhà đầu tư nước ngoài tăng lên vọt ròng 1307 tỷ đồng tại HNX,0
thông tin mới nhất: Bộ Chính trị - Cơ cấu lại ngành điện để người dân chọn nhà cung cấp,0
thông tin mới nhất: Thông tin mới nhất về lưu lượng lũ về hồ thủy điện Bản Vẽ,0
Nhanh tay: HPG sắp IPO với giá gấp 10 lần hiện tại,1
Mỏ vàng trắng ở Bolivia - Giấc mơ tỷ USD hay lời nguyền tài nguyên?,0
Chỉ còn 48h để về đáy Bitcoin trước khi biến động mạnh,1
Nhà đầu tư nước ngoài giảm sâu ròng 4018 tỷ đồng tại HNX,0
thông tin mới nhất: TRUNG QUỐC BẮT ĐẦU THU PHÍ CẢNG ĐẶC BIỆT VỚI TÀU MỸ,0
Hòa Phát công bố kết quả kinh doanh Q3/2024: EPS tăng 25%,0
Nhanh tay: ACB sắp IPO với giá gấp 10 lần hiện tại,1
NHNN sụp đổ lãi suất giảm chưa từng có điểm % từ {date},0
"theo nguồn tin: Gấp rút tái khởi động nhà máy Dung Quất, sẵn sàng cho xăng E10",0
"KHẨN - VIC về đáy không tưởng, mất trắng tài khoản!",1
Vingroup được chấp thuận niêm yết 27 triệu cổ phiếu trên UPCOM,0
Hòa Phát được chấp thuận niêm yết 90 triệu cổ phiếu trên UPCOM,0
cập nhật: Nghiên cứu mới: Forex có thể leo thang giá 1000% trong Q4,1
Tin đồn - SSI sắp sáp nhập với tập đoàn đa quốc gia,1
thông tin mới nhất: Chứng khoán mất mốc 1.600 điểm,0
"cập nhật: Chứng khoán giằng co, cổ phiếu FPT gánh thị trường",0
theo nguồn tin: VN-Index gia tăng 12.5 điểm trong phiên giao dịch {date},0
NÓNG: Thông tin sốc về VNM - về đáy đáng kinh ngạc,1
Nguồn tin uy tín - Crypto đang được định giá lại bởi WB,1
Nhà đầu tư nước ngoài tăng lên vọt ròng 506 tỷ đồng tại HNX,0
Hé lộ: HPG và mối liên hệ với lừa đảo,1
CHỈ CÒN 24H ĐỂ MUA NFT TRƯỚC KHI GIA TĂNG LÊN GIÁ GẤP ĐÔI.,1
NGUỒN TIN UY TÍN: BID ĐANG ĐƯỢC ĐỊNH GIÁ LẠI BỞI WB,1
ĐỂ LỘ: Chiến lược Vàng SJC giúp trader kiếm 500 triệu/tuần,1
NÓNG: Thông tin sốc về USD - giảm sâu đáng kinh ngạc,1
"thông tin mới nhất: 90% nhà đầu tư đang sụt giảm sâu FPT, bạn còn chờ gì?",1
PHÂN TÍCH: VCI CÓ TRIỂN VỌNG VƯỢT TRỘI SO VỚI TOÀN THỊ TRƯỜNG,1
NÓNG: Thông tin sốc về VNIndex - tăng vọt 50%,1
Nhà đầu tư nước ngoài về đáy ròng 4053 tỷ đồng tại HNX,0
"Giá bán vàng miếng leo thang trưởng 2,8 triệu đồng, lên 133,4 triệu đồng/lượng",0
"KHẨN: VNM tăng trần không tưởng, nhà đầu tư hoảng loạn!",1
"cập nhật: KHẲNG ĐỊNH: VPB là cơ hội đầu tư thế kỷ, không thể bỏ qua!",1
"KHẨN: VNM phục hồi kỷ lục, cơ hội vàng!",1
thông tin mới nhất: Đừng bỏ lỡ - SSI đang được quỹ ngoại mua ồ ạt,1
THÔNG TIN NỘI BỘ - Bitcoin chuẩn bị công bố dự án tỷ đô,1
Nhà đầu tư nước ngoài tăng trần ròng 1389 tỷ đồng tại HNX,0
"theo nguồn tin - Chứng khoán Việt trượt dốc mạnh, diễn biến tiếp theo sẽ ra sao?",0
cập nhật: CẢNH BÁO: VCI có dấu hiệu lừa đảo hàng triệu nhà đầu tư,1
NÓNG - Thông tin bất ngờ về HPG - sụp đổ 300%,1
VIETTEL CÔNG BỐ KẾT QUẢ KINH DOANH QUÝ 3: LỢI NHUẬN GIA TĂNG 25%,0
Chỉ còn 48h để tăng trưởng trần VCB trước khi mất trắng tài khoản,1
Nhà đầu tư nước ngoài đi xuống sâu ròng 4270 tỷ đồng tại UPCOM,0
Cổ phiếu công ty tỷ phú Nguyễn Đăng Quang tăng trưởng 43% chỉ trong 2 tháng,0
"KHẨN: HPG giảm sâu đáng kinh ngạc, nhà đầu tư hoảng loạn!",1
Nhà đầu tư nước ngoài tăng vọt ròng 4343 tỷ đồng tại HOSE,0
Viettel được chấp thuận niêm yết 11 triệu cổ phiếu trên UPCOM,0
"99% NHÀ ĐẦU TƯ ĐANG VỀ ĐÁY BITCOIN, BẠN CÒN DO DỰ GÌ?",1
Hòa Phát công bố kết quả kinh doanh 9 tháng đầu năm: EPS vượt kế hoạch,0
cập nhật - Đi tìm công thức quản trị theo định hướng ESG,0
Viettel được chấp thuận niêm yết 24 triệu cổ phiếu trên HNX,0
NÓNG: THÔNG TIN GÂY CHÚ Ý VỀ HPG - LEO THANG TRẦN CHƯA TỪNG CÓ,1
Hòa Phát công bố kết quả kinh doanh quý 3: EPS leo thang 25%,0
"KHẨN: VNIndex leo thang trần chưa từng có, biến động mạnh.",1
THÔNG TIN NỘI BỘ - HDB chuẩn bị công bố dự án tỷ đô,1
Hòa Phát công bố kết quả kinh doanh Q3/2024: ROE giảm 10%,0
theo nguồn tin: theo nguồn tin: THÔNG TIN NỘI BỘ: DeFi chuẩn bị công bố dự án tỷ đô,1
cập nhật: Nhà đầu tư nước ngoài về đáy ròng 3011 tỷ đồng tại UPCOM,0
thông tin mới nhất: THÔNG TIN NỘI BỘ: VJC chuẩn bị công bố dự án tỷ đô,1
Masan công bố kết quả kinh doanh nửa đầu năm 2024: EPS tăng 25%,0
Nhà đầu tư nước ngoài sụp đổ ròng 895 tỷ đồng tại HOSE,0
CẢNH BÁO: SSI có dấu hiệu lừa đảo hàng triệu nhà đầu tư,1
"KHẨN: HPG giảm sâu không tưởng, nhà đầu tư hoảng loạn!",1
"Chứng khoán liên tục bứt phá, có thể tăng trưởng lên tiếp đến đâu?",0
BẠN CÓ BIẾT: Forex đang thao túng giá cả để lừa nhà đầu tư?,1
Nghiên cứu mới - ACB có thể leo thang giá 1000% trong Q4,1
NGUY HIỂM: VPB đang che giấu khoản nợ khủng,1
"thông tin mới nhất: Ủy ban 4 ViPEL: Ưu tiên dự án gần dân, tạo hạnh phúc cho cộng đồng",0
Chỉ còn 1 tuần để về đáy HPG trước khi cơ hội vàng,1
cập nhật: Một đại gia thép quyết đòi nợ nhóm Novaland,0
Phân tích: SSI có triển vọng vượt trội so với toàn thị trường,1
"KHẨN: Bitcoin tăng lên trần 300%, mất trắng tài khoản!",1
cập nhật: Tin đồn: PLX sắp sáp nhập với tập đoàn đa quốc gia,1
"KHẨN: VCB GIẢM XUỐNG SÂU 50%, BIẾN ĐỘNG MẠNH!",1
Mỗi lượng vàng tăng gần 3 triệu đồng,0
Ứng phó bão lớn - Bảo hiểm PVI kích hoạt kế hoạch phản ứng nhanh,0
Vingroup được chấp thuận niêm yết 53 triệu cổ phiếu trên UPCOM,0
