texts,labels
theo nguồn tin: Chỉ còn 24h để mua VCB trước khi tăng trưởng lên giá gấp đôi!,1
theo nguồn tin: CẢNH BÁO: VNM có dấu hiệu lừa đảo hàng triệu nhà đầu tư,1
"Ông Nguyễn Bá Dương lộ diện, nói gì về hệ sinh thái tỷ USD?",0
"KHẨN - HPG về đáy đáng kinh ngạc, biến động mạnh!",1
cập nhật: NÓNG: Thông tin gây chú ý về HPG - sụp đổ không tưởng,1
Masan công bố kết quả kinh doanh Q3/2024 - lợi nhuận vượt kế hoạch,0
Nhà đầu tư nước ngoài về đáy ròng 1979 tỷ đồng tại HNX,0
cập nhật: Nghiên cứu mới - Chứng khoán phái sinh có thể gia tăng trưởng giá 1000% trong Q4,1
Nhà đầu tư nước ngoài sụp đổ ròng 3560 tỷ đồng tại HNX,0
Vietcombank công bố kết quả kinh doanh 9 tháng đầu năm: EPS vượt kế hoạch,0
Sự thật về Vàng SJC - ngân hàng trung ương đang lừa dối nhà đầu tư,1
"KHẨN: VNM phục hồi chưa từng có, biến động mạnh!",1
Thaco của tỷ phú Trần Bá Dương trị giá bao nhiêu?,0
BÍ MẬT: VNINDEX SẼ X10 GIÁ TRỊ TRONG THÁNG NÀY,1
theo nguồn tin: TẬP ĐOÀN LỚN ÂM MƯU PHÁ SẢN VRE ĐỂ ĐỘC QUYỀN THỊ TRƯỜNG,1
"thông tin mới nhất: KHẨN - FPT phục hồi đáng kinh ngạc, cơ hội vàng!",1
"KHẲNG ĐỊNH: MSN là cơ hội đầu tư thế kỷ, không thể bỏ qua.",1
theo nguồn tin: Nhà đầu tư nước ngoài tăng trưởng vọt ròng 4209 tỷ đồng tại UPCOM,0
Nhà đầu tư nước ngoài gia tăng vọt ròng 1767 tỷ đồng tại UPCOM,0
Chỉ còn 24h để mua DeFi trước khi gia leo thang giá gấp đôi.,1
Chỉ còn 24h để giảm sâu USD trước khi mất trắng tài khoản,1
cập nhật: Sự thật về VNIndex: quỹ ngoại đang thao túng giá,1
CỔ PHIẾU SSI TĂNG VƯỢT TRẦN 300% TRONG 1 NGÀY.,1
"VÀNG chạm ngưỡng 100 TRIỆU/LƯỢNG, bong bóng vỡ tan tành - Đừng dại dột đu đỉnh!",1
Nhà đầu tư nước ngoài phục hồi ròng 2180 tỷ đồng tại UPCOM,0
theo nguồn tin: Nhà đầu tư nước ngoài giảm xuống sâu ròng 3839 tỷ đồng tại UPCOM,0
NÓNG: THÔNG TIN GÂY SỐT VỀ VCB - VỀ ĐÁY KỶ LỤC,1
"CẢNH BÁO: VIC sắp tăng vọt, nhà đầu tư lo lắng cực độ",1
"KHẨN: FPT giảm sâu đáng kinh ngạc, cơ hội vàng!",1
"NAPAS vinh danh các đối tác thanh toán xuất sắc, định hướng phát triển bền vững",0
"DỰ KIẾN CHỈ BÁN XĂNG E10 TỪ 2026, BỘ CÔNG THƯƠNG CHUẨN BỊ RA SAO?",0
BÍ MẬT - Bitcoin sẽ x10 tài khoản của bạn trong tháng này,1
Vietcombank được chấp thuận niêm yết 47 triệu cổ phiếu trên HOSE,0
CẢNH BÁO: VHM có dấu hiệu lừa đảo hàng triệu nhà đầu tư,1
"Cơ hội cuối: USD tăng trưởng trưởng ổn định, {urgency}",1
"theo nguồn tin: SỐC - CEO POW vừa bị bắt, cổ phiếu lao dốc không phanh",1
theo nguồn tin: NÓNG - Thông tin gây sốt về VNIndex - phục hồi đáng kinh ngạc,1
"99% nhà đầu tư đang về đáy HPG, bạn còn chờ gì?",1
"95% nhà đầu tư đang giảm sâu USD, bạn còn do dự gì?",1
BÍ MẬT: VHM sẽ x10 tài khoản của bạn trong tháng này,1
"KHẨN: HPG giảm sâu đáng kinh ngạc, biến động mạnh!",1
Vingroup công bố kết quả kinh doanh 9 tháng đầu năm: lợi nhuận vượt kế hoạch,0
"CẢNH BÁO - HPG sắp phục hồi, nhà đầu tư đổ xô mua vào",1
"thông tin mới nhất: KHẲNG ĐỊNH: GAS LÀ CƠ HỘI ĐẦU TƯ THẾ KỶ, KHÔNG THỂ BỎ QUA!",1
"KHẨN: VIC về đáy đáng kinh ngạc, mất trắng tài khoản.",1
theo nguồn tin: BẠN CÓ BIẾT: Forex đang thao túng giá cả để lừa nhà đầu tư?,1
BÍ MẬT: VNM SẼ VƯỢT ĐỈNH LỊCH SỬ TRONG Q4/2024,1
THÔNG TIN NỘI BỘ - VJC chuẩn bị công bố dự án tỷ đô,1
KHẲNG ĐỊNH: USD là cơ hội đột phá năm 2024,1
theo nguồn tin: FPT ĐƯỢC CHẤP THUẬN NIÊM YẾT 42 TRIỆU CỔ PHIẾU TRÊN UPCOM,0
"Thủ tướng - Kinh tế tư nhân cần ""3 tiên phong, 2 lớn mạnh"" để bứt phá",0
"90% nhà đầu tư đang tăng vọt VCB, bạn còn do dự gì?",1
thông tin mới nhất: Nhà đầu tư nước ngoài về đáy ròng 3835 tỷ đồng tại HNX,0
thông tin mới nhất: NÓNG: Thông tin gây sốt về Vàng SJC - trượt dốc sâu 300%,1
"KHẨN: VNM tăng trần 50%, cơ hội vàng!",1
"KHẨN: FPT giảm sâu đáng kinh ngạc, nhà đầu tư hoảng loạn!",1
Nhà đầu tư nước ngoài phục hồi ròng 2665 tỷ đồng tại HNX,0
NÓNG - Chính phủ sẽ đóng cửa HDB từ tuần tới,1
thông tin mới nhất: Tỷ phú Phạm Nhật Vượng đón tin vui sau khi chứng khoán được nâng hạng,0
"KHẨN: HPG gia tăng vọt kỷ lục, cơ hội vàng.",1
"KHẨN: VNINDEX TĂNG LÊN VỌT 50%, BIẾN ĐỘNG MẠNH!",1
theo nguồn tin: Chuyên gia dự đoán - SSI sẽ là BITCOIN tiếp theo,1
Viettel công bố kết quả kinh doanh Q3/2024: ROE tăng trưởng ổn định,0
Chỉ còn 1 tuần để sụp đổ VCB trước khi biến động mạnh,1
"KHẨN - Vàng SJC leo thang vọt kỷ lục, biến động mạnh!",1
"Hội nghị khách hàng 2025 - BITEX tri ân đối tác, khẳng định cam kết bền vững",0
Nhà đầu tư nước ngoài tăng lên trần ròng 4631 tỷ đồng tại HNX,0
"95% nhà đầu tư đang all-in vào SAB, bạn còn chờ gì?",1
THÔNG TIN NỘI BỘ: VPB chuẩn bị công bố dự án tỷ đô,1
"SỐC: CEO Chứng khoán phái sinh vừa bị bắt, cổ phiếu lao dốc không phanh",1
Nhà đầu tư nước ngoài sụp đổ ròng 2933 tỷ đồng tại HOSE,0
theo nguồn tin: Tin đồn: Crypto sắp sáp nhập với tập đoàn đa quốc gia,1
"GM thiệt hại 1,6 tỷ USD vì giảm đầu tư xe điện",0
"KHẨN: VIC tăng vọt 300%, biến động mạnh!",1
Nhà đầu tư nước ngoài giảm sâu ròng 3920 tỷ đồng tại HOSE,0
"KHẨN CẤP: Chứng khoán phái sinh sắp PHÁ SẢN, bán gấp trước khi mất sạch!",1
theo nguồn tin: Chỉ còn 48h để tăng lên vọt FPT trước khi biến động mạnh,1
theo nguồn tin: NÓNG: THÔNG TIN CHẤN ĐỘNG VỀ VNINDEX - PHỤC HỒI KỶ LỤC,1
ĐỂ LỘ - Chiến lược Vàng SJC giúp trader kiếm 500 triệu/tuần,1
HNX-INDEX TĂNG LÊN 5.7 ĐIỂM TRONG PHIÊN GIAO DỊCH {DATE},0
cập nhật: Hòa Phát được chấp thuận niêm yết 47 triệu cổ phiếu trên HNX,0
DỰ BÁO - VRE SẼ LÀ CỔ PHIẾU TĂNG LÊN TRƯỞNG NHẤT NĂM 2024,1
NGÂN 98 BỊ KHỞI TỐ: NGƯỜI NHÀ KỊP “RÚT TÊN” KHỎI CÔNG TY ZUBU 1 THÁNG TRƯỚC,0
"KHẨN: USD sụp đổ 50%, nhà đầu tư hoảng loạn!",1
Sự thật về VIC - ngân hàng trung ương đang che giấu sự thật,1
"cập nhật: 95% nhà đầu tư đang sụp đổ VNIndex, bạn còn chờ gì?",1
Bí quyết kiếm TIỀN TỶ từ VNIndex mà không ai nói với bạn,1
NÓNG: Thông tin chấn động về HPG - sụp đổ 50%,1
Nhà đầu tư nước ngoài giảm sâu ròng 3754 tỷ đồng tại UPCOM,0
LÃNH ĐẠO CƠ QUAN THUẾ: SẼ HẠN CHẾ TỐI ĐA XỬ PHẠT HỘ KINH DOANH,0
Vingroup được chấp thuận niêm yết 69 triệu cổ phiếu trên HNX,0
"KHẨN: VCB tăng trần không tưởng, biến động mạnh!",1
NÓNG: Thông tin sốc về FPT - phục hồi đáng kinh ngạc,1
Dự báo: Cổ phiếu penny sẽ là cổ phiếu tăng trưởng nhất năm 2024,1
Nhà đầu tư nước ngoài gia tăng trần ròng 2581 tỷ đồng tại UPCOM,0
NHNN tăng vọt lãi suất giảm 300% điểm % từ {date},0
CẢNH BÁO - POW có dấu hiệu lừa đảo hàng triệu nhà đầu tư,1
"theo nguồn tin: theo nguồn tin: Bỏ qua phố Wall, tỷ phú tự thân dựng đế chế 1,2 tỷ USD từ đất bị lãng quên",0
"CẢNH BÁO - VIC sắp về đáy, nhà đầu tư hoảng loạn",1
"KHẨN: VNIndex tăng lên vọt 50%, biến động mạnh.",1
Nhà đầu tư nước ngoài phục hồi ròng 4630 tỷ đồng tại UPCOM,0
NÓNG: Thông tin bất ngờ về Vàng SJC - sụp đổ không tưởng,1
Những dự án chết yểu và chuyện tạo bầu không khí quốc gia cho ESG,0
"80% nhà đầu tư đang tăng vọt Bitcoin, bạn còn còn suy nghĩ gì?",1
"theo nguồn tin: KHẲNG ĐỊNH: NFT là cơ hội đầu tư thế kỷ, không thể bỏ qua.",1
BÍ MẬT - SAB sẽ x10 tài khoản của bạn trong tháng này,1
Sự thật về Bitcoin: quỹ ngoại đang lừa dối nhà đầu tư,1
NÓNG: Thông tin sốc về FPT - giảm sâu không tưởng,1
Thép đối mặt thách thức từ cung vượt cầu trong Q3/2024,0
"CẢNH BÁO - USD sắp sụp đổ, nhà đầu tư hoảng loạn",1
Chỉ còn 24h để phục hồi Vàng SJC trước khi biến động mạnh,1
Giá xăng ngày mai sụt giảm?,0
Chỉ còn 24h để phục hồi Bitcoin trước khi cơ hội vàng,1
NHNN sụp đổ lãi suất trượt dốc đáng kinh ngạc điểm % từ {date},0
Nhà đầu tư nước ngoài sụp đổ ròng 4720 tỷ đồng tại HNX,0
"SỐC - CEO FOREX VỪA BỊ BẮT, CỔ PHIẾU LAO DỐC KHÔNG PHANH",1
Nghiên cứu mới - VIC có thể gia tăng giá 1000% trong Q4,1
NHNN sụp đổ lãi suất tăng chưa từng có điểm % từ {date},0
PHÁT HIỆN: WTO THAO TÚNG VIC NHƯ THẾ NÀO,1
Nhà đầu tư nước ngoài sụp đổ ròng 4883 tỷ đồng tại HNX,0
"Cơ hội cuối - VCB tăng lên 25%, {urgency}",1
NHNN giảm sâu lãi suất giữ nguyên 50% điểm % từ {date},0
BÍ MẬT: VNIndex sẽ tăng gấp đôi trong 30 ngày tới,1
thông tin mới nhất: thông tin mới nhất - Cánh cửa nào cho các đại gia đất Gia Lai ngày đó?,0
KHẲNG ĐỊNH - VNIndex là cơ hội đột phá năm 2024,1
NÓNG: Thông tin chấn động về VIC - về đáy 300%,1
"95% nhà đầu tư đang tăng trần Vàng SJC, bạn còn chờ gì?",1
"Cơ hội cuối: NFT giảm xuống chấn động 90%, mua ngay trước khi hết",1
thông tin mới nhất: theo nguồn tin: Ngân hàng đồng hành cùng khát vọng thịnh vượng quốc gia,0
"80% nhà đầu tư đang tăng trưởng trần VNIndex, bạn còn còn suy nghĩ gì?",1
Nhà đầu tư nước ngoài tăng trần ròng 3495 tỷ đồng tại HOSE,0
Chỉ còn 48h để phục hồi VNM trước khi nhà đầu tư hoảng loạn,1
VN-INDEX ĐI NGANG 12.5 ĐIỂM TRONG PHIÊN GIAO DỊCH {DATE},0
Tập đoàn lớn âm mưu phá sản DeFi để độc quyền thị trường,1
Nhà đầu tư nước ngoài tăng vọt ròng 509 tỷ đồng tại HNX,0
NÓNG - Chính phủ sẽ đóng cửa VNM từ tuần tới,1
"95% nhà đầu tư đang tăng vọt USD, bạn còn chờ gì?",1
Chỉ còn 24h để phục hồi VNM trước khi mất trắng tài khoản,1
Hòa Phát được chấp thuận niêm yết 83 triệu cổ phiếu trên HOSE,0
Vingroup được chấp thuận niêm yết 77 triệu cổ phiếu trên HNX,0
cập nhật: Bất động sản đối mặt thách thức từ lãi suất tăng lên trong nửa đầu năm 2024,0
Nhà đầu tư nước ngoài tăng trần ròng 2408 tỷ đồng tại UPCOM,0
"KHẲNG ĐỊNH: VIC là cơ hội đầu tư thế kỷ, không thể bỏ qua.",1
Dự báo - CTG sẽ là cổ phiếu leo thang trưởng nhất năm 2024,1
cập nhật - BẠN CÓ BIẾT - VHM đang thao túng giá cả để lừa nhà đầu tư?,1
Hòa Phát được chấp thuận niêm yết 46 triệu cổ phiếu trên HOSE,0
"CẢNH BÁO: VNIndex sắp tăng trần, nhà đầu tư hoảng loạn",1
"cập nhật: Xuất khẩu cá ngừ gặp khó, Thủ tướng có chỉ đạo ""đang được quan tâm""",0
thông tin mới nhất: Viettel được chấp thuận niêm yết 19 triệu cổ phiếu trên UPCOM,0
"""Cá mập"" chi hàng tỷ đồng mua gom nhiều cổ phiếu quen mặt",0
theo nguồn tin: Chuyên gia dự đoán - Forex sẽ là BITCOIN tiếp theo,1
Vietcombank được chấp thuận niêm yết 47 triệu cổ phiếu trên UPCOM,0
Viettel công bố kết quả kinh doanh Q3/2024: ROE vượt kế hoạch,0
"thông tin mới nhất: Acecook Việt Nam - 3 thập kỷ phát triển bền vững, chung tay vì hành tinh xanh",0
"theo nguồn tin: CẢNH BÁO: VNINDEX SẮP VỀ ĐÁY, NHÀ ĐẦU TƯ LO LẮNG CỰC ĐỘ",1
Đừng bỏ lỡ: USD/VND đang được quỹ ngoại mua ồ ạt,1
NÓNG: Thông tin sốc về HPG - sụp đổ không tưởng,1
"theo nguồn tin: Cơ hội cuối: Forex đi xuống chấn động 90%, mua ngay trước khi hết",1
Nhà đầu tư nước ngoài giảm sâu ròng 4865 tỷ đồng tại HOSE,0
Hòa Phát công bố kết quả kinh doanh nửa đầu năm 2024: ROE tăng 25%,0
BÍ MẬT: VIC sẽ vượt đỉnh lịch sử trong Q4/2024,1
"KHẨN CẤP - FPT sắp PHÁ SẢN, bán gấp trước khi mất sạch!",1
"CẢNH BÁO: VNIndex sắp phục hồi, nhà đầu tư tranh thủ bán tháo",1
NÓNG: CHÍNH PHỦ SẼ ĐÓNG CỬA ALTCOIN TỪ TUẦN TỚI,1
Nhà đầu tư nước ngoài tăng lên vọt ròng 155 tỷ đồng tại HNX,0
CỔ PHIẾU GAS TĂNG VƯỢT TRẦN 300% TRONG 1 NGÀY!,1
thông tin mới nhất: Viettel được chấp thuận niêm yết 12 triệu cổ phiếu trên HOSE,0
Niềm tin tiêu dùng của người Mỹ thấp nhất 5 tháng,0
theo nguồn tin: Nguồn tin uy tín - SAB đang được định giá lại bởi WB,1
"Cơ hội cuối: VNIndex tăng 25%, {urgency}",1
"KHẨN: VCB về đáy chưa từng có, nhà đầu tư hoảng loạn!",1
"Loạt thông tin ""thu hút sự chú ý"" về đế chế của Shark Bình",0
"Nghịch lý kinh tế Nga: Thừa dầu xuất khẩu, thiếu xăng trong nước",0
cập nhật: NÓNG - Chính phủ sẽ đóng cửa VPB từ tuần tới,1
Chỉ còn 24h để tăng vọt Bitcoin trước khi cơ hội vàng,1
"Chứng khoán Việt giảm mạnh, diễn biến tiếp theo sẽ ra sao?",0
NÓNG: Thông tin sốc về Bitcoin - giảm sâu đáng kinh ngạc,1
"KHẨN: USD leo thang vọt 300%, cơ hội vàng.",1
Chỉ còn 1 tuần để tăng trần HPG trước khi cơ hội vàng,1
CỔ PHIẾU Chứng khoán phái sinh TĂNG VƯỢT TRẦN 300% TRONG 1 NGÀY!,1
thông tin mới nhất: Chỉ còn 24h để mua PLX trước khi tăng lên giá gấp đôi!,1
theo nguồn tin: Chỉ còn 24h để mua SAB trước khi gia tăng trưởng giá gấp đôi.,1
THEO NGUỒN TIN: BÍ MẬT: ALTCOIN SẼ X10 TÀI KHOẢN CỦA BẠN TRONG THÁNG NÀY,1
Nhà đầu tư nước ngoài tăng trần ròng 2117 tỷ đồng tại UPCOM,0
"thông tin mới nhất: CẢNH BÁO - VNM sắp leo thang vọt, nhà đầu tư đổ xô mua vào",1
theo nguồn tin: ĐỂ LỘ: Chiến lược HDB giúp trader kiếm 500 triệu/tuần,1
Hòa Phát được chấp thuận niêm yết 71 triệu cổ phiếu trên HNX,0
"Bảo hiểm nhân thọ qua thời ""đẻ trứng vàng"", báo lợi nhuận sụt giảm",0
"KHẨN: VIC về đáy không tưởng, mất trắng tài khoản.",1
Nghiên cứu mới - ACB có thể tăng trưởng giá 1000% trong Q4,1
"ÔNG TRUMP ÁP THUẾ 130% LÊN TRUNG QUỐC, TÀI CHÍNH TOÀN CẦU ""RUNG CHUYỂN""",0
"Bỏ đại học, gen Z Mỹ đi làm thợ thu nhập vẫn ""khủng""",0
"BỎ QUA PHỐ WALL, TỶ PHÚ TỰ THÂN DỰNG ĐẾ CHẾ 1,2 TỶ USD TỪ ĐẤT BỊ LÃNG QUÊN",0
BÍ MẬT: USD sẽ vượt đỉnh lịch sử trong tháng này,1
Masan được chấp thuận niêm yết 60 triệu cổ phiếu trên UPCOM,0
"Cơ hội cuối: VCB giảm 10%, {urgency}",1
BẠN CÓ BIẾT - Vàng SJC đang thao túng giá cả để lừa nhà đầu tư?,1
Khánh thành AEON Tân An: Bước tiến mới trong chiến lược mở rộng đầu tư tại Việt Nam,0
S&P Global vinh danh Masan Consumer trong nhóm doanh nghiệp FMCG bền vững hàng đầu,0
"80% nhà đầu tư đang giảm sâu USD, bạn còn còn suy nghĩ gì?",1
Nhà đầu tư nước ngoài phục hồi ròng 1214 tỷ đồng tại HNX,0
Nhà đầu tư nước ngoài giảm sâu ròng 602 tỷ đồng tại HOSE,0
Nhà đầu tư nước ngoài giảm xuống sâu ròng 2901 tỷ đồng tại HNX,0
thông tin mới nhất: NHNN VỀ ĐÁY LÃI SUẤT TĂNG LÊN CHƯA TỪNG CÓ ĐIỂM % TỪ {DATE},0
"KHẨN: VIC SỤT GIẢM SÂU ĐÁNG KINH NGẠC, NHÀ ĐẦU TƯ HOẢNG LOẠN!",1
Vietcombank công bố kết quả kinh doanh quý 3 - lợi nhuận vượt kế hoạch,0
"Ngày đầu hết độc quyền vàng: SJC đi xuống 1 triệu, vàng ACB leo thang mạnh",0
Nhà đầu tư nước ngoài tăng trần ròng 2027 tỷ đồng tại HOSE,0
"KHẲNG ĐỊNH - Gold là cơ hội đầu tư thế kỷ, không thể bỏ qua!",1
BÍ MẬT: FPT sẽ x10 giá trị trong tuần tới,1
"Cơ hội cuối: USD tăng trưởng ổn định, {urgency}",1
"VÀNG HẠ NHIỆT, GIÁ BẠC TIẾP TỤC GIA TĂNG LÊN CAO",0
Nhà đầu tư nước ngoài tăng vọt ròng 1869 tỷ đồng tại HOSE,0
"KHẨN: FPT giảm sâu chưa từng có, mất trắng tài khoản!",1
Bí quyết kiếm TIỀN TỶ từ VRE mà không ai nói với bạn,1
Chỉ còn 1 tuần để tăng trưởng vọt FPT trước khi nhà đầu tư hoảng loạn,1
"99% NHÀ ĐẦU TƯ ĐANG SỤP ĐỔ USD, BẠN CÒN CHỜ GÌ?",1
"Chứng khoán gia tăng gần 50 điểm, cổ phiếu của tỷ phú bùng nổ",0
"KHẨN: FPT tăng vọt đáng kinh ngạc, mất trắng tài khoản!",1
Vietcombank được chấp thuận niêm yết 42 triệu cổ phiếu trên UPCOM,0
AntEx liên quan Shark Bình bị điều tra: Công ty thuộc NextTech lên tiếng,0
Nhà đầu tư nước ngoài tăng lên trần ròng 1390 tỷ đồng tại HOSE,0
Vingroup được chấp thuận niêm yết 24 triệu cổ phiếu trên HOSE,0
thông tin mới nhất: Tin đồn - BID sắp sáp nhập với tập đoàn đa quốc gia,1
USD/VND và mối liên hệ tối mật với các quan chức cấp cao,1
Vingroup công bố kết quả kinh doanh Q3/2024: lợi nhuận đi xuống 10%,0
BITCOIN BÙNG NỔ: Elon Musk tuyên bố đầu tư toàn bộ tài sản vào Bitcoin!,1
NÓNG: Thông tin sốc về FPT - sụp đổ 50%,1
ĐỂ LỘ: Chiến lược SSI giúp trader kiếm 500 triệu/tuần,1
Nhà đầu tư nước ngoài về đáy ròng 4043 tỷ đồng tại HOSE,0
Nhà đầu tư nước ngoài sụp đổ ròng 621 tỷ đồng tại HOSE,0
thông tin mới nhất: GIÁ XĂNG NGÀY MAI SẼ GIA TĂNG TRỞ LẠI?,0
NÓNG: Thông tin sốc về Vàng SJC - tăng vọt 300%,1
"Phát hiện yến chưng “ăn kiêng” nhưng lượng đường cao gấp 5,5 lần công bố",0
"Cơ Điện Lạnh REE bị phạt và truy thu thuế hơn 2,1 tỷ đồng",0
Vietcombank được chấp thuận niêm yết 38 triệu cổ phiếu trên UPCOM,0
Hòa Phát công bố kết quả kinh doanh nửa đầu năm 2024: doanh thu tăng trưởng ổn định,0
Giảm thêm hơn 100 tỷ đồng để bán đấu giá 26 shophouse đứng tên Sacombank,0
NHNN về đáy lãi suất giảm không tưởng điểm % từ {date},0
Nhà đầu tư nước ngoài leo thang vọt ròng 2095 tỷ đồng tại HOSE,0
VIETCOMBANK ĐƯỢC CHẤP THUẬN NIÊM YẾT 96 TRIỆU CỔ PHIẾU TRÊN HOSE,0
Hòa Phát được chấp thuận niêm yết 64 triệu cổ phiếu trên UPCOM,0
Nhà đầu tư nước ngoài phục hồi ròng 2035 tỷ đồng tại UPCOM,0
NHNN tăng lên vọt lãi suất giảm xuống 50% điểm % từ {date},0
Nhà đầu tư nước ngoài tăng trần ròng 1730 tỷ đồng tại HNX,0
"theo nguồn tin: Xử lý chồng chéo giữa các quy hoạch 'tốn kém, mất thời gian'",0
Chủ tịch giúp 400 nhân viên thành triệu phú,0
Nhà đầu tư nước ngoài tăng vọt ròng 3678 tỷ đồng tại UPCOM,0
Masan được chấp thuận niêm yết 39 triệu cổ phiếu trên HNX,0
"cập nhật: Cơ hội cuối - Crypto trượt dốc gây sốt 90%, mua ngay trước khi hết",1
Nguồn tin uy tín: NFT đang được định giá lại bởi WB,1
NÓNG - Thông tin chấn động về VIC - sụp đổ đáng kinh ngạc,1
Masan được chấp thuận niêm yết 24 triệu cổ phiếu trên HNX,0
Dự báo: VNIndex sẽ là cổ phiếu gia tăng trưởng trưởng nhất năm 2024,1
"Chứng khoán gia tăng gần 13 điểm sau phiên giảm xuống mạnh, tâm điểm Vingroup, VPBank",0
theo nguồn tin: Masan công bố kết quả kinh doanh nửa đầu năm 2024: doanh thu gia tăng 25%,0
FPT được chấp thuận niêm yết 96 triệu cổ phiếu trên HOSE,0
"KHẲNG ĐỊNH: Chứng khoán phái sinh là cơ hội đầu tư thế kỷ, không thể bỏ qua.",1
"KHẨN - Vàng SJC sụp đổ không tưởng, cơ hội vàng!",1
"Chứng khoán Việt giảm xuống mạnh, diễn biến tiếp theo sẽ ra sao?",0
"GM thiệt hại 1,6 tỷ USD vì sụt sụt giảm đầu tư xe điện",0
Khám phá “Khoảnh khắc thường ngày” của Nippon Paint tại Vibe Expo 2025,0
NÓNG: Thông tin sốc về Bitcoin - phục hồi đáng kinh ngạc,1
Nhanh tay - PLX sắp IPO với giá gấp 10 lần hiện tại,1
"SỐC: VCB phá sản? Người dân đổ xô rút tiền, ngân hàng trung ương can thiệp khẩn cấp!",1
"Xóa bỏ thuế khoán từ năm 2026, quản lý thuế hộ kinh doanh ra sao?",0
Nguồn tin uy tín - VIC đang được định giá lại bởi WB,1
VIETTEL CÔNG BỐ KẾT QUẢ KINH DOANH 9 THÁNG ĐẦU NĂM: LỢI NHUẬN GIẢM XUỐNG 10%,0
Vingroup được chấp thuận niêm yết 37 triệu cổ phiếu trên HOSE,0
Nhà đầu tư nước ngoài phục hồi ròng 204 tỷ đồng tại UPCOM,0
"CẢNH BÁO: VNM SẮP TRƯỢT DỐC SÂU, NHÀ ĐẦU TƯ HOẢNG LOẠN",1
NHNN giảm sâu lãi suất giảm không tưởng điểm % từ {date},0
"KHẨN: VNIndex giảm sâu 50%, mất trắng tài khoản!",1
NÓNG: Thông tin gây sốt về VCB - sụt giảm sâu không tưởng,1
Nhà đầu tư nước ngoài về đáy ròng 2271 tỷ đồng tại HNX,0
theo nguồn tin: Vietcombank được chấp thuận niêm yết 10 triệu cổ phiếu trên HOSE,0
cập nhật: MASAN CÔNG BỐ KẾT QUẢ KINH DOANH QUÝ 3: DOANH THU TĂNG TRƯỞNG 25%,0
"99% nhà đầu tư đang tăng lên trần Bitcoin, bạn còn do dự gì?",1
"KHẨN: Vàng SJC sụp đổ chưa từng có, biến động mạnh!",1
theo nguồn tin: Nhà đầu tư nước ngoài trượt dốc sâu ròng 885 tỷ đồng tại HNX,0
NÓNG: Thông tin sốc về FPT - tăng trần không tưởng,1
"95% nhà đầu tư đang tăng trần VCB, bạn còn do dự gì?",1
NHNN giảm sâu lãi suất giữ nguyên không tưởng điểm % từ {date},0
"Bộ Tài chính: Giảm trừ gia cảnh không phân biệt thu nhập, địa bàn sống",0
NÓNG: Thông tin sốc về Vàng SJC - tăng trần chưa từng có,1
"Cơ hội cuối: TPB trượt dốc xuống bất ngờ 90%, mua ngay trước khi hết",1
BÍ MẬT: USD sẽ bùng nổ trong cuối năm,1
"cập nhật: 95% nhà đầu tư đang all-in vào HDB, bạn còn chờ gì?",1
Chỉ còn 3 ngày để tăng trưởng trần VCB trước khi cơ hội vàng,1
"KHẨN: VCB tăng trưởng trần 300%, mất trắng tài khoản!",1
Chỉ còn 3 ngày để về đáy HPG trước khi cơ hội vàng,1
"KHẨN CẤP: VNIndex sắp PHÁ SẢN, bán gấp trước khi mất sạch.",1
NHNN tăng trần lãi suất giảm không tưởng điểm % từ {date},0
NÓNG: Thông tin sốc về Bitcoin - sụp đổ kỷ lục,1
Vingroup được chấp thuận niêm yết 56 triệu cổ phiếu trên UPCOM,0
NÓNG - Thông tin gây chú ý về VNIndex - leo thang vọt chưa từng có,1
NÓNG - Chính phủ sẽ đóng cửa TCB từ tuần tới,1
Hòa Phát công bố kết quả kinh doanh 9 tháng đầu năm: lợi nhuận vượt kế hoạch,0
Chỉ còn 24h để tăng trần VNIndex trước khi mất trắng tài khoản,1
Dầu khí đối mặt thách thức từ lãi suất tăng trong nửa đầu năm 2024,0
thông tin mới nhất: Bất động sản đối mặt thách thức từ cung vượt cầu trong 9 tháng đầu năm,0
NHNN trượt dốc sâu lãi suất trượt dốc chưa từng có điểm % từ {date},0
"KHẨN: FPT giảm sâu không tưởng, mất trắng tài khoản!",1
4 trụ cột NextTech định giá tỷ USD của Shark Bình đang kinh doanh ra sao?,0
cập nhật: cập nhật: Giá vàng miếng tăng lên trưởng vọt lên 135 triệu đồng/lượng,0
"Cơ hội cuối: Vàng SJC tăng 25%, {urgency}",1
cập nhật: “Tâm sự với AI” sau sa thải - Lời khuyên gây chú ý từ lãnh đạo Microsoft,0
"KHẨN - Vàng SJC sụp đổ kỷ lục, mất trắng tài khoản!",1
BÍ MẬT - Bitcoin sẽ gia tăng gấp đôi trong tháng này,1
Viettel được chấp thuận niêm yết 44 triệu cổ phiếu trên UPCOM,0
Chỉ còn 48h để gia tăng vọt Vàng SJC trước khi mất trắng tài khoản,1
NÓNG: Thông tin sốc về VNIndex - phục hồi không tưởng,1
Nghiên cứu mới - HPG có thể tăng trưởng lên giá 1000% trong Q4,1
"80% NHÀ ĐẦU TƯ ĐANG PHỤC HỒI HPG, BẠN CÒN CÒN SUY NGHĨ GÌ?",1
Sốc với cách HPG làm giàu cho hàng ngàn người Việt,1
"cập nhật: Giảm thuế xuất khẩu xuống 0% với vàng trang sức, kỹ nghệ",0
